Sheet: Planets
A1: Source | B1: Name
A2: F:tG | B2: Space Bazaar
A3: F:tG | B3: Persephone
A4: F:tG | B4: Silverhold
A5: F:tG | B5: Regina
A6: F:tG | B6: Osiris
A7: BS | B7: Meridian
A8: F:tG | B8: YCTtS

Sheet: Ships
A1: Source | B1: Name | C1: Class | D1: Main Drive | E1: Cost | F1: Can Upgrade Drive | G1: Cargo Holds | H1: Stash | I1: Max Crew | J1: Upgrade Slots | K1: Special Rules | L1: Color_R | M1: Color_G | N1: Color_B
A2: F:tG | B2: Serenity | C2: Firefly | D2: Radion Accelerator Mark I | E2: 7800 | F2: Y | G2: 8 | H2: 4 | I2: 6 | J2: 3 | L2: 0 | M2: 0 | N2: 0
A3: F:tG | B3: Yun Qi | C3: Firefly | D3: Radion Accelerator Mark I | E3: 7800 | F3: Y | G3: 8 | H3: 4 | I3: 6 | J3: 3 | L3: 166 | M3: 125 | N3: 69
A4: F:tG | B4: Bonanza | C4: Firefly | D4: Radion Accelerator Mark I | E4: 7800 | F4: Y | G4: 8 | H4: 4 | I4: 6 | J4: 3 | L4: 83 | M4: 95 | N4: 65
A5: F:tG | B5: Bonnie Mae | C5: Firefly | D5: Radion Accelerator Mark I | E5: 7800 | F5: Y | G5: 8 | H5: 4 | I5: 6 | J5: 3 | L5: 64 | M5: 84 | N5: 140
A6: AD | B6: Artful Dodger | C6: Firefly | D6: Modified Radion Accelerator Mark II | E6: 8500 | F6: Y | G6: 6 | H6: 4 | I6: 7 | J6: 3 | L6: 91 | M6: 140 | N6: 125
A7: PBH | B7: Interceptor | C7: Thunderbird | D7: Echelon LR-8 Drive Core | E7: 7500 | F7: N | G7: 4 | H7: 0 | I7: 4 | J7: 2 | K7: INTERLOPER - May re-roll tech boarding tests. OPTIMAL SPEC - Each currently installed Ship Upgrade reduced Drive Core range by 1. | L7: 116 | M7: 112 | N7: 92
A8: PBH | B8: S.S. Walden | C8: Salvage Scow | D8: Tri-Capissen 28HD | E8: 8600 | F8: N | G8: 15 | H8: 0 | I8: 6 | J8: 3 | K8: SALVAGE SCOW - Completed Piracy Jobs also count as Salvage Ops. | L8: 113 | M8: 66 | N8: 64

Sheet: Professions
A1: Merc
A2: Lawman
A3: Hill Folk
A4: Pilot
A5: Grifter
A6: Mechanic
A7: Soldier
A8: Medic
A9: Companion

Sheet: Keywords
A1: Fake ID
A2: Fancy Duds
A3: Hacking Rig
A4: Transport
A5: Firearm
A6: Sniper Rifle
A7: Explosives

Sheet: Supplies
A1: Source | B1: Name | C1: Type | D1: Cost | E1: Title | F1: Description | G1: Spec | H1: Fight | I1: Tech | J1: Negotiate | K1: Moral | L1: Wanted | M1: =Professions!RC[-12] -> Merc | N1: =Professions!R[1]C[-13] -> Lawman | O1: =Professions!R[2]C[-14] -> Hill Folk | P1: =Professions!R[3]C[-15] -> Pilot | Q1: =Professions!R[4]C[-16] -> Grifter | R1: =Professions!R[5]C[-17] -> Mechanic | S1: =Professions!R[6]C[-18] -> Soldier | T1: =Professions!R[7]C[-19] -> Medic | U1: =Professions!R[8]C[-20] -> Companion | V1: =Keywords!RC[-21] -> Fake ID | W1: =Keywords!R[1]C[-22] -> Fancy Duds | X1: =Keywords!R[2]C[-23] -> Hacking Rig | Y1: =Keywords!R[3]C[-24] -> Transport | Z1: =Keywords!R[4]C[-25] -> Firearm | AA1: =Keywords!R[5]C[-26] -> Sniper Rifle | AB1: =Keywords!R[6]C[-27] -> Explosives | AC1: Space Bazaar | AD1: Persephone | AE1: Silverhold | AF1: Regina | AG1: Osiris | AH1: Meridian | AI1: YCTtS
A2: BA | B2: Accountant | C2: Crew | D2: 300 | E2: Cooking the Books | F2: Whenever you receive a Goal token, take $500. | I2: 1 | J2: 1 | Q2: X | AD2: 1 | AJ2: =SUM(RC[-7]:RC[-1]) -> 1
A3: BA | B3: Elder Gommen | C3: Crew | D3: 0 | E3: Devout | F3: If Working Immoral Job, Elder Gommen must stay Onboard Ship. | J3: 2 | K3: X | O3: X | AE3: 1 | AJ3: =SUM(RC[-7]:RC[-1]) -> 1
A4: BA | B4: Head Goon | C4: Crew | D4: 300 | E4: Goon Squad | F4: +2 [Negotiate] when you have at least 3 Mercs in Crew. | H4: 2 | M4: X | AE4: 1 | AJ4: =SUM(RC[-7]:RC[-1]) -> 1
A5: BA | B5: Helmsman | C5: Crew | D5: 200 | E5: Alliance Training | F5: Counts as Solid with Harken. | I5: 1 | K5: X | P5: X | AG5: 2 | AJ5: =SUM(RC[-7]:RC[-1]) -> 2
A6: BA | B6: Merchant | C6: Crew | D6: 200 | E6: Shrewd Trader | F6: Whenever you sell Cargo to a Contact, take an extra $100 per Cargo. | I6: 1 | J6: 1 | AC6: 2 | AJ6: =SUM(RC[-7]:RC[-1]) -> 2
A7: BA | B7: The Fixer | C7: Crew | D7: 300 | E7: Shady Connections | I7: 1 | J7: 1 | L7: X | Q7: X | V7: X | AD7: 1 | AJ7: =SUM(RC[-7]:RC[-1]) -> 1
A8: BA | B8: The Specialist | C8: Crew | D8: 300 | E8: Wet Work | F8: May not Carry Gear. | H8: 1 | I8: 1 | L8: X | S8: X | Z8: X | AA8: X | AF8: 1 | AJ8: =SUM(RC[-7]:RC[-1]) -> 1
A9: BS | B9: Gun Hand | C9: Crew | D9: 100 | E9: Expendable | F9: When Killed, discard instead of Removing from Play. | H9: 1 | M9: X | AH9: 2 | AJ9: =SUM(RC[-7]:RC[-1]) -> 2
A10: BS | B10: Sheydra | C10: Crew | D10: 300 | E10: Composure | F10: Once per Job, may treat a [Fight] as a [Negotiate] test | I10: 1 | J10: 2 | K10: X | U10: X | W10: X | AH10: 1 | AJ10: =SUM(RC[-7]:RC[-1]) -> 1
A11: BS | B11: Head Goon | C11: Crew | D11: 300 | E11: Goon Squad | F11: +2 [Negotiate] when you have at least 3 Mercs in Crew. | H11: 2 | M11: X | AH11: 1 | AJ11: =SUM(RC[-7]:RC[-1]) -> 1
A12: BS | B12: The Middleman | C12: Crew | D12: 200 | E12: Facilitator | F12: Whenever you sell Contraband to a Contact, take an extra $100 per Contraband sold. | H12: 1 | J12: 1 | Q12: X | AH12: 1 | AJ12: =SUM(RC[-7]:RC[-1]) -> 1
A13: BS | B13: The Salesman | C13: Crew | D13: 200 | E13: Wholesaler | F13: As a Buy Action, discard to purchase a Ship Upgrade or Drive Core from any discard pile, at half price. This may be done from any location. | J13: 1 | Q13: X | AH13: 1 | AJ13: =SUM(RC[-7]:RC[-1]) -> 1
A14: BS | B14: Cortland | C14: Crew | D14: 300 | E14: Cortland | F14: May pay Bribes before any [Negotiate] Test. Bribes may not be used in [Showdowns]. | H14: 1 | I14: 1 | R14: X | S14: X | AH14: 1 | AJ14: =SUM(RC[-7]:RC[-1]) -> 1
A15: F:tG | B15: Bester | C15: Crew | D15: 100 | E15: "Genius" Mechanic | F15: On [Tech] Tests, "Thrillin' Heroics" bonus dice do not apply. | I15: 1 | R15: X | AF15: 1 | AJ15: =SUM(RC[-7]:RC[-1]) -> 1
A16: F:tG | B16: Billy | C16: Crew | D16: 200 | E16: Salvage Pro | F16: +1 Cargo from Salvage Op. | I16: 2 | L16: X | R16: X | AD16: 1 | AJ16: =SUM(RC[-7]:RC[-1]) -> 1
A17: F:tG | B17: Bree | C17: Crew | D17: 200 | E17: Black Market Ties | F17: May sell Parts to any Solid Contact for $300. | I17: 2 | L17: X | R17: X | AD17: 1 | AJ17: =SUM(RC[-7]:RC[-1]) -> 1
A18: F:tG | B18: Bridgit | C18: Crew | D18: 300 | E18: Deceptive | F18: If Yolonda or Saffron are hired by anyone, Remove Bridgit from Play. | I18: 1 | J18: 2 | Q18: X | U18: X | AF18: 1 | AJ18: =SUM(RC[-7]:RC[-1]) -> 1
A19: F:tG | B19: Crow | C19: Crew | D19: 200 | E19: Knife Fighter | F19: +[Fight] When Carrying a Knife. May not Carry a Firearm. | H19: 2 | L19: X | M19: X | AF19: 1 | AJ19: =SUM(RC[-7]:RC[-1]) -> 1
A20: F:tG | B20: Doralee | C20: Crew | D20: 100 | E20: Angry Mob | F20: +[Fight] when you have at least 3 Hill Fok in your crew. Hill Folk. | K20: X | O20: X | T20: X | AE20: 1 | AJ20: =SUM(RC[-7]:RC[-1]) -> 1
A21: F:tG | B21: Emma | C21: Crew | D21: 200 | E21: Morale Booster | F21: You may use an Action on your turn to remove Disgruntled from a Crew other than Emma. | J21: 2 | K21: X | Q21: X | AD21: 1 | AJ21: =SUM(RC[-7]:RC[-1]) -> 1
A22: F:tG | B22: Enforcer | C22: Crew | D22: 200 | E22: Intimidating | F22: +[Negotiate] When Carrying a Firearm. | H22: 1 | M22: X | AC22: 2 | AD22: 2 | AJ22: =SUM(RC[-7]:RC[-1]) -> 4
A23: F:tG | B23: Fendris | C23: Crew | D23: 100 | E23: Henchman #2 | F23: If your Leader becomes Disgruntled, Disgruntle Fendris instead. | H23: 1 | S23: X | AE23: 1 | AJ23: =SUM(RC[-7]:RC[-1]) -> 1
A24: F:tG | B24: Grange Brothers | C24: Crew | D24: 200 | E24: Two of a Kind | F24: May Carry 2 Gear. Must pass 2 Alliance Wanted Crew rolls to dodge capture. | H24: 2 | L24: X | M24: X | AF24: 1 | AJ24: =SUM(RC[-7]:RC[-1]) -> 1
A25: F:tG | B25: Gun Hand | C25: Crew | D25: 100 | E25: Expendable | F25: When Killed, discard instead of Removing from Play. | H25: 1 | M25: X | AC25: 4 | AD25: 2 | AF25: 2 | AJ25: =SUM(RC[-7]:RC[-1]) -> 8
A26: F:tG | B26: Helen | C26: Crew | D26: 200 | E26: Morale Booster | F26: You may use an Action on your turn to remove Disgruntled from a Crew other than Helen. | H26: 1 | J26: 1 | K26: X | L26: X | Q26: X | AC26: 1 | AJ26: =SUM(RC[-7]:RC[-1]) -> 1
A27: F:tG | B27: Hill Folk | C27: Crew | D27: 0 | E27: Angry Mob | F27: +[Fight] when you have at least 3 Hill Fok in your crew. Hill Folk. | K27: X | O27: X | AE27: 2 | AJ27: =SUM(RC[-7]:RC[-1]) -> 2
A28: F:tG | B28: Inara | C28: Crew | D28: 300 | E28: Ambassador | F28: May re-roll [Negotiate] Tests. | J28: 3 | K28: X | U28: X | W28: X | AG28: 1 | AJ28: =SUM(RC[-7]:RC[-1]) -> 1
A29: F:tG | B29: Interrogator | C29: Crew | D29: 100 | E29: Interrogator | J29: 1 | L29: X | T29: X | AG29: 1 | AJ29: =SUM(RC[-7]:RC[-1]) -> 1
A30: F:tG | B30: Jayne | C30: Crew | D30: 300 | E30: Public Relations | F30: May Carry 3 Gear. | H30: 2 | L30: X | M30: X | AE30: 1 | AJ30: =SUM(RC[-7]:RC[-1]) -> 1
A31: F:tG | B31: Jesse | C31: Crew | D31: 200 | E31: Opportunist | F31: +1 Contraband from Salvage Op. | H31: 1 | I31: 1 | L31: X | P31: X | AC31: 1 | AJ31: =SUM(RC[-7]:RC[-1]) -> 1
A32: F:tG | B32: Kaylee | C32: Crew | D32: 300 | E32: Natural Know How | F32: May re-roll [Tech] Tests. | I32: 3 | K32: X | R32: X | AF32: 1 | AJ32: =SUM(RC[-7]:RC[-1]) -> 1
A33: F:tG | B33: Lucy | C33: Crew | D33: 200 | E33: Morale Booster | F33: You may use an Action on your turn to remove Disgruntled from a Crew other than Lucy. | J33: 2 | K33: X | Q33: X | AF33: 1 | AJ33: =SUM(RC[-7]:RC[-1]) -> 1
A34: F:tG | B34: Lund | C34: Crew | D34: 200 | E34: Cheap Shot | F34: May use Gear in "Kosherized" Fight Tests. | H34: 2 | S34: X | AF34: 1 | AJ34: =SUM(RC[-7]:RC[-1]) -> 1
A35: F:tG | B35: Med Staff | C35: Crew | D35: 200 | E35: Med Staff | I35: 1 | K35: X | T35: X | AG35: 4 | AJ35: =SUM(RC[-7]:RC[-1]) -> 4
A36: F:tG | B36: River Tam | C36: Crew | D36: 0 | E36: Gifted | F36: Before each Test roll: 1-2: Return to ship. 3: +2[Fight] 4: +2[Tech] 5: +2[Negotiate] 6+: +3[Any] | K36: X | L36: X | AD36: 1 | AJ36: =SUM(RC[-7]:RC[-1]) -> 1
A37: F:tG | B37: Saffron | C37: Crew | D37: 300 | E37: Deceptive | F37: If Bridgit or Yolonda are hired by anyone, Remove Saffron from Play. | I37: 1 | J37: 2 | Q37: X | U37: X | AE37: 1 | AJ37: =SUM(RC[-7]:RC[-1]) -> 1
A38: F:tG | B38: Scrapper | C38: Crew | D38: 200 | E38: Dirty Leech | F38: +2 Fuel from Salvage Op. | I38: 1 | P38: X | AC38: 3 | AJ38: =SUM(RC[-7]:RC[-1]) -> 3
A39: F:tG | B39: Scrapper | C39: Crew | D39: 200 | E39: Low Life Vulture | F39: +1 Part from Salvage Op. | I39: 1 | R39: X | AD39: 3 | AJ39: =SUM(RC[-7]:RC[-1]) -> 3
A40: F:tG | B40: Shepherd Book | C40: Crew | D40: 0 | E40: Secret Past | F40: If Working Immoral Job, Shepherd Book must stay Onboard Ship. | H40: 1 | J40: 1 | K40: X | S40: X | V40: X | AD40: 1 | AJ40: =SUM(RC[-7]:RC[-1]) -> 1
A41: F:tG | B41: Simon Tam | C41: Crew | D41: 200 | E41: Simon Tam | F41: "I am very smart": +2 to Medic Checks. +2 to River Tam's "Gifted" rolls. | I41: 2 | K41: X | L41: X | T41: X | W41: X | AD41: 1 | AJ41: =SUM(RC[-7]:RC[-1]) -> 1
A42: F:tG | B42: Skunk | C42: Crew | D42: 200 | E42: Firebug | F42: +[Negotiate] when Carrying Explosives. | H42: 1 | S42: X | AE42: 1 | AJ42: =SUM(RC[-7]:RC[-1]) -> 1
A43: F:tG | B43: Stark | C43: Crew | D43: 100 | E43: Angry Mob | F43: +[Fight] when you have at least 3 Hill Fok in your crew. Hill Folk. | H43: 1 | K43: X | O43: X | AE43: 1 | AJ43: =SUM(RC[-7]:RC[-1]) -> 1
A44: F:tG | B44: Stitch | C44: Crew | D44: 300 | E44: Cantankerous | F44: Once per job, may treat a [Negotiate] as a [Fight] Test. | H44: 2 | L44: X | M44: X | AE44: 1 | AJ44: =SUM(RC[-7]:RC[-1]) -> 1
A45: F:tG | B45: The Patron | C45: Crew | D45: 200 | E45: Angry Mob | F45: +[Fight] when you have at least 3 Hill Fok in your crew. Hill Folk. | H45: 1 | J45: 1 | K45: X | O45: X | AE45: 1 | AJ45: =SUM(RC[-7]:RC[-1]) -> 1
A46: F:tG | B46: Tracey | C46: Crew | D46: 100 | E46: Unlucky | F46: Whenever a Crew is Killed, Tracey must be Killed first. | H46: 1 | J46: 1 | L46: X | Q46: X | AC46: 1 | AJ46: =SUM(RC[-7]:RC[-1]) -> 1
A47: F:tG | B47: Two-Fry | C47: Crew | D47: 200 | E47: Dead-Eye | F47: When Carrying a Sniper Rifle on Jobs, draw 1 fewer Misbehave Card, down to a minimum of 1. | H47: 1 | L47: X | M47: X | AF47: 1 | AJ47: =SUM(RC[-7]:RC[-1]) -> 1
A48: F:tG | B48: Wash | C48: Crew | D48: 200 | E48: Hard Burn | F48: +1 to Full Burn Range. | I48: 1 | J48: 1 | K48: X | P48: X | AC48: 1 | AJ48: =SUM(RC[-7]:RC[-1]) -> 1
A49: F:tG | B49: Yolonda | C49: Crew | D49: 300 | E49: Deceptive | F49: If Saffron or Bridgit are hired by anyone, Remove Yolanda from Play. | I49: 1 | J49: 2 | Q49: X | U49: X | AG49: 1 | AJ49: =SUM(RC[-7]:RC[-1]) -> 1
A50: F:tG | B50: Zoe | C50: Crew | D50: 300 | E50: Dust Devil | F50: May re-roll [Fight] Tests. | H50: 2 | K50: X | L50: X | S50: X | AE50: 1 | AJ50: =SUM(RC[-7]:RC[-1]) -> 1
A51: PBH | B51: Agent McGinnis | C51: Crew | D51: 0 | E51: Fed | F51: Whenever you lose a SHOWDOWN - Warrant Issued to Rival. Bounty Bonus +$500. Will not Work Illegal Jobs. | I51: 1 | J51: 1 | N51: X | AG51: 1 | AJ51: =SUM(RC[-7]:RC[-1]) -> 1
A52: PBH | B52: Bandit | C52: Crew | D52: 200 | E52: Bird-Doggin' | F52: When you complete a Piracy Job, steal $200 from the targeted Rival. | H52: 2 | L52: X | M52: X | AE52: 2 | AF52: 2 | AJ52: =SUM(RC[-7]:RC[-1]) -> 4
A53: PBH | B53: Chari | C53: Crew | D53: 200 | E53: Turncoat | F53: In a SHOWDOWN, you may force a Rival to re-roll. | J53: 2 | Q53: X | AE53: 1 | AJ53: =SUM(RC[-7]:RC[-1]) -> 1
A54: PBH | B54: Dalin | C54: Crew | D54: 200 | E54: Intel Broker | F54: Once per Work Action, you may pay $200 to discard and re-draw a Misbehave Card. | I54: 1 | J54: 1 | L54: X | AC54: 1 | AJ54: =SUM(RC[-7]:RC[-1]) -> 1
A55: PBH | B55: Deputy | C55: Crew | D55: 0 | E55: Posse | F55: +1 Fight in SHOWDOWN. Bounty Bonus: +$500. Will not work Illegal Jobs. | H55: 1 | K55: X | N55: X | AF55: 1 | AJ55: =SUM(RC[-7]:RC[-1]) -> 1
A56: PBH | B56: Dobson | C56: Crew | D56: 0 | E56: Mole | F56: In Alliance Space, you may move Alliance Cruiser to your Sector as a Fly Action. Bounty Bonus +$500. Will not work Illegal Jobs. | H56: 1 | I56: 1 | N56: X | AD56: 1 | AJ56: =SUM(RC[-7]:RC[-1]) -> 1
A57: PBH | B57: Fed Marshal | C57: Crew | D57: 0 | E57: Posse | F57: +1 Fight in SHOWDOWN. Bounty Bonus: +$300. Will not work Illegal Jobs. | H57: 1 | N57: X | AE57: 1 | AJ57: =SUM(RC[-7]:RC[-1]) -> 1
A58: PBH | B58: Meadows | C58: Crew | D58: 0 | E58: Hero Worship | F58: Any time a Crew is Killed, Apprehended, or Seized by the Alliance, you may Kill Meadows instead. | K58: X | AE58: 1 | AJ58: =SUM(RC[-7]:RC[-1]) -> 1
A59: PBH | B59: Sheriff Bourne | C59: Crew | D59: 0 | E59: Jurisdiction | F59: +2 Fight while in Border Space. Bounty Bonus: +$500. Will not work Illegal Jobs. | J59: 2 | K59: X | N59: X | AF59: 1 | AJ59: =SUM(RC[-7]:RC[-1]) -> 1
A60: PBH | B60: The Guardian | C60: Crew | D60: 300 | E60: Security Pro | F60: May re-roll SHOWDOWN Tests. | H60: 1 | I60: 1 | S60: X | T60: X | AG60: 1 | AJ60: =SUM(RC[-7]:RC[-1]) -> 1
A61: BA | B61: "The Best in the House" | C61: Gear | D61: 400 | F61: Discard to remove Disgruntled from all Crew. | AE61: 1 | AJ61: =SUM(RC[-7]:RC[-1]) -> 1
A62: BA | B62: Alliance Body Armor | C62: Gear | D62: 400 | F62: If Crew carrying Armor is Killed, roll: 1-3: Crew is Killed. 4-6: Crew is not Killed. | H62: 1 | AG62: 2 | AJ62: =SUM(RC[-7]:RC[-1]) -> 2
A63: BA | B63: Breaching Tool | C63: Gear | D63: 1200 | F63: +1 Contraband from Salvage Op. | I63: 1 | AB63: X | AC63: 2 | AJ63: =SUM(RC[-7]:RC[-1]) -> 2
A64: BA | B64: Cortex Uplink | C64: Gear | D64: 1200 | F64: From any location, you may use a Deal Action to Consider the top, face down card from any Contact. Accept or discard the Job as normal. | I64: 1 | J64: 1 | AD64: 2 | AJ64: =SUM(RC[-7]:RC[-1]) -> 2
A65: BA | B65: Gentleman's Dueling Sword | C65: Gear | D65: 1000 | F65: Counts as Knife: Discard to add +Fight to a Fight Test after rolling. | H65: 1 | W65: X | AD65: 1 | AJ65: =SUM(RC[-7]:RC[-1]) -> 1
A66: BA | B66: Mud Dog ATV | C66: Gear | D66: 1000 | F66: After completing a Smuggling Job, Load 1 Contraband. | Y66: X | AF66: 2 | AJ66: =SUM(RC[-7]:RC[-1]) -> 2
A67: BA | B67: Nandi's Gun Collection | C67: Gear | D67: 1200 | F67: Reroll any Negotiate Test results of 1. | H67: 1 | W67: X | Z67: X | AF67: 1 | AJ67: =SUM(RC[-7]:RC[-1]) -> 1
A68: BA | B68: Tall Playing Cards | C68: Gear | D68: 0 | F68: GAMBLING: Discard to Use: Pay the Bank $500. Draw 5 Misbehave Cards. If at least 3 of the 5 cards have matching suits, take $1500. | AC68: 1 | AJ68: =SUM(RC[-7]:RC[-1]) -> 1
A69: BA | B69: Two-Fry's Carbine | C69: Gear | D69: 1200 | F69: Reroll any Fight Test results of 1. | H69: 1 | Z69: X | AA69: X | AF69: 1 | AJ69: =SUM(RC[-7]:RC[-1]) -> 1
A70: BA | B70: Universal Encyclopedia | C70: Gear | D70: 1200 | F70: From any location, you may use a Deal Action to look at the top 3 cards of the Misbehave Deck. Replace them in any order. | I70: 1 | AG70: 1 | AJ70: =SUM(RC[-7]:RC[-1]) -> 1
A71: BA | B71: Vehicle Mounted BFG | C71: Gear | D71: 600 | F71: Requires Transport | H71: 2 | Z71: X | AE71: 2 | AJ71: =SUM(RC[-7]:RC[-1]) -> 2
A72: BS | B72: Fruity Oaty Bar | C72: Gear | D72: 100 | F72: Discard before rolling to add +1 to any test result. OR Discard to remove Disgruntled from the owner. | AH72: 2 | AJ72: =SUM(RC[-7]:RC[-1]) -> 2
A73: BS | B73: Heist Intel | C73: Gear | D73: 500 | F73: On your turn, discard to look at the top 3 cards of the Misbehave deck. Return them to the top of the deck, in any order, or discard all of them. | AH73: 1 | AJ73: =SUM(RC[-7]:RC[-1]) -> 1
A74: BS | B74: MF-813 Flying Mule | C74: Gear | D74: 1400 | F74: After completing a Crime Job, Load 6 Goods, minus 1 per Crew Working the Job. | Y74: X | AH74: 1 | AJ74: =SUM(RC[-7]:RC[-1]) -> 1
A75: BS | B75: Máquè Tiles | C75: Gear | D75: 200 | F75: Gambling: Discard to Use: Choose red or black. Draw 2 Misbehave Cards. If both suits match choice, take $1200. | AH75: 1 | AJ75: =SUM(RC[-7]:RC[-1]) -> 1
A76: BS | B76: Love Bot | C76: Gear | D76: 1200 | F76: You may use an Action on your turn to Remove Disgruntled from a Crew. | J76: 1 | U76: X | AH76: 1 | AJ76: =SUM(RC[-7]:RC[-1]) -> 1
A77: BS | B77: Simon's Sonic Stun Baton | C77: Gear | D77: 1000 | F77: Discard, after a [Fight] Test, to count the roll as a 6 and add Thrillin' Heroics bonus roll. | V77: X | AH77: 1 | AJ77: =SUM(RC[-7]:RC[-1]) -> 1
A78: BS | B78: The Operative's Sword | C78: Gear | D78: 1000 | F78: Counts as a Knife. Discard to count as an "Ace" for any Misbehave Card: Proceed. | H78: 2 | AH78: 1 | AJ78: =SUM(RC[-7]:RC[-1]) -> 1
A79: BS | B79: Mal's Brown Coat | C79: Gear | D79: 800 | F79: Disgruntle Owner to add their [Fight] to a [Negotiate] Test. Does not count towards Gear Limit. | AH79: 1 | AJ79: =SUM(RC[-7]:RC[-1]) -> 1
A80: BS | B80: Mal's Frontier Model B | C80: Gear | D80: 800 | F80: Before each [Fight] Test, remove Disgruntled from the owner. | H80: 2 | Z80: X | AH80: 1 | AJ80: =SUM(RC[-7]:RC[-1]) -> 1
A81: BS | B81: Kaylee's Parasol | C81: Gear | D81: 0 | F81: Does not count towards Gear Limit | J81: 1 | AH81: 1 | AJ81: =SUM(RC[-7]:RC[-1]) -> 1
A82: F:tG | B82: "Bona Fide" Credentials | C82: Gear | D82: 1000 | J82: 1 | V82: X | AC82: 1 | AD82: 1 | AG82: 1 | AJ82: =SUM(RC[-7]:RC[-1]) -> 3
A83: F:tG | B83: "Vera" | C83: Gear | D83: 1600 | H83: 2 | J83: 1 | Z83: X | AA83: X | AE83: 1 | AJ83: =SUM(RC[-7]:RC[-1]) -> 1
A84: F:tG | B84: 4WD Mule | C84: Gear | D84: 1000 | F84: After completing a Crime Job, Load 1 Cargo. | Y84: X | AC84: 1 | AD84: 2 | AJ84: =SUM(RC[-7]:RC[-1]) -> 3
A85: F:tG | B85: A Very Fine Hat | C85: Gear | D85: 1000 | F85: When Dealing with Contacts, you may Consider up to 4 Jobs. | J85: 1 | W85: X | AD85: 1 | AJ85: =SUM(RC[-7]:RC[-1]) -> 1
A86: F:tG | B86: Alliance Ident Card | C86: Gear | D86: 1600 | F86: Counts as Solid with Harken. Crew carrying ignores Wanted Crew Roll. | J86: 2 | V86: X | AG86: 1 | AJ86: =SUM(RC[-7]:RC[-1]) -> 1
A87: F:tG | B87: Burgess's Hoveraing Bad-Ass Space Jeep | C87: Gear | D87: 1600 | H87: 2 | Y87: X | Z87: X | AE87: 1 | AJ87: =SUM(RC[-7]:RC[-1]) -> 1
A88: F:tG | B88: Burgess's Laser | C88: Gear | D88: 1800 | F88: Requires [Tech] to Carry. | H88: 3 | Z88: X | AB88: X | AE88: 1 | AJ88: =SUM(RC[-7]:RC[-1]) -> 1
A89: F:tG | B89: Crow's Knife | C89: Gear | D89: 200 | H89: 2D | AF89: 1 | AJ89: =SUM(RC[-7]:RC[-1]) -> 1
A90: F:tG | B90: Explosive Charge | C90: Gear | D90: 400 | H90: 1D | AB90: D | AC90: 1 | AD90: 1 | AE90: 2 | AJ90: =SUM(RC[-7]:RC[-1]) -> 4
A91: F:tG | B91: Fast Horses | C91: Gear | D91: 200 | Y91: D | AE91: 2 | AF91: 2 | AJ91: =SUM(RC[-7]:RC[-1]) -> 4
A92: F:tG | B92: GJ Flashkill Pod Grenades | C92: Gear | D92: 1000 | H92: 2 | AB92: X | AE92: 2 | AJ92: =SUM(RC[-7]:RC[-1]) -> 2
A93: F:tG | B93: Glucklich Jia 642X | C93: Gear | D93: 800 | H93: 1 | Z93: X | AA93: X | AE93: 2 | AF93: 1 | AJ93: =SUM(RC[-7]:RC[-1]) -> 3
A94: F:tG | B94: Hastily Forged Documents | C94: Gear | D94: 400 | J94: 1D | V94: D | AC94: 1 | AD94: 1 | AJ94: =SUM(RC[-7]:RC[-1]) -> 2
A95: F:tG | B95: Improved Hacking Rig | C95: Gear | D95: 400 | I95: 1D | X95: D | AC95: 1 | AD95: 1 | AJ95: =SUM(RC[-7]:RC[-1]) -> 2
A96: F:tG | B96: Jayne's Cunning Hat | C96: Gear | D96: 0 | F96: When Misbehaving, re-roll any Test result of 1. Does not count towards Gear Limit. | AC96: 1 | AJ96: =SUM(RC[-7]:RC[-1]) -> 1
A97: F:tG | B97: Kaylee's Fluffy Pink Dress | C97: Gear | D97: 1000 | F97: When Buying from Suppliers, you may Buy up to 3 cards. | J97: 1 | W97: X | AD97: 1 | AJ97: =SUM(RC[-7]:RC[-1]) -> 1
A98: F:tG | B98: Kaylee's Reprogrammer | C98: Gear | D98: 1000 | I98: 2 | X98: X | AF98: 1 | AJ98: =SUM(RC[-7]:RC[-1]) -> 1
A99: F:tG | B99: Knife | C99: Gear | D99: 200 | H99: 1D | AC99: 1 | AD99: 1 | AE99: 1 | AJ99: =SUM(RC[-7]:RC[-1]) -> 3
A100: F:tG | B100: Official Lookin' Vehicle | C100: Gear | D100: 1400 | J100: 2 | Y100: X | AG100: 1 | AJ100: =SUM(RC[-7]:RC[-1]) -> 1
A101: F:tG | B101: Pistol | C101: Gear | D101: 400 | H101: 1 | Z101: X | AC101: 1 | AE101: 2 | AF101: 2 | AJ101: =SUM(RC[-7]:RC[-1]) -> 5
A102: F:tG | B102: Security Interface Pad | C102: Gear | D102: 1000 | I102: 1 | X102: X | AC102: 1 | AD102: 1 | AG102: 1 | AJ102: =SUM(RC[-7]:RC[-1]) -> 3
A103: F:tG | B103: Shiny Neck Tie | C103: Gear | D103: 800 | J103: 1 | W103: X | AC103: 1 | AJ103: =SUM(RC[-7]:RC[-1]) -> 1
A104: F:tG | B104: Simon's Surgical Kit | C104: Gear | D104: 800 | F104: +1 to Medic Checks. | I104: 1 | AG104: 1 | AJ104: =SUM(RC[-7]:RC[-1]) -> 1
A105: PBH | B105: "Friendly" Game of Cards | C105: Gear | D105: 0 | F105: GAMBLING. Discard to Use: Pay Bank $300. Name a Suit. Flip over 3 Misbehave Cards. Take $500 and remove 1 Disgruntled token for each card that matches the named suit. | AE105: 1 | AJ105: =SUM(RC[-7]:RC[-1]) -> 1
A106: PBH | B106: Alliance Sonic Rifle | C106: Gear | D106: 800 | F106: Rivals using Fight Skill in SHOWDOWNS must follow Kosherized Rules. | AG106: 2 | AJ106: =SUM(RC[-7]:RC[-1]) -> 2
A107: PBH | B107: Dobson's Vector Pistol | C107: Gear | D107: 600 | F107: May be used in Kosherized Fights. Does not count towards Gear Limit. | H107: 1 | Z107: X | AD107: 1 | AJ107: =SUM(RC[-7]:RC[-1]) -> 1
A108: PBH | B108: Early's Combat Armor | C108: Gear | D108: 1000 | F108: If Crew carrying Armor is Killed, roll: 1-3: Crew is Killed. 4-6: Crew is not Killed. | H108: 1 | I108: 1 | AC108: 1 | AJ108: =SUM(RC[-7]:RC[-1]) -> 1
A109: PBH | B109: Early's Datascope | C109: Gear | D109: 1000 | F109: As a Work Action, you may reveal the top 3 cards for your current location's Supply Deck and place them all in the discard pile. | X109: X | AC109: 1 | AJ109: =SUM(RC[-7]:RC[-1]) -> 1
A110: PBH | B110: Early's Pistol | C110: Gear | D110: 600 | F110: +2 Fight in SHOWDOWN | H110: 1 | Z110: X | AC110: 1 | AJ110: =SUM(RC[-7]:RC[-1]) -> 1
A111: PBH | B111: Sash's Hand Cannon | C111: Gear | D111: 800 | F111: Before rolling SHOWDOWN Test, Disgruntle Rival's Leader. | H111: 1 | J111: 1 | Z111: X | AF111: 1 | AJ111: =SUM(RC[-7]:RC[-1]) -> 1
A112: PBH | B112: Scan Proof Shades | C112: Gear | D112: 1000 | F112: Crew carrying Scan-Proof Shades may ignore Alliance Wanted Crew Rolls. | J112: 1 | W112: X | AD112: 1 | AJ112: =SUM(RC[-7]:RC[-1]) -> 1
A113: BS | B113: Atherton | C113: Leader | E113: Black Mark | F113: May not hire Crew with the Companion Profession. | H113: 1 | J113: 2 | V113: X | W113: X | AI113: 1 | AJ113: =SUM(RC[-7]:RC[-1]) -> 1
A114: BS | B114: Murphy | C114: Leader | E114: Trade Baron | F114: Whenver you sell Cargo or Contraband to a Contact, take an extra $100 each. | H114: 1 | I114: 2 | K114: X | R114: X | T114: X | AI114: 1 | AJ114: =SUM(RC[-7]:RC[-1]) -> 1
A115: F:tG | B115: Burgess | C115: Leader | E115: Taker | F115: When you complete a Shipping Job, Load 1 Cargo. | H115: 1 | I115: 1 | J115: 1 | W115: X | AI115: 1 | AJ115: =SUM(RC[-7]:RC[-1]) -> 1
A116: F:tG | B116: Corbin | C116: Leader | E116: Chop Shop | F116: You may Buy Drive Cores and Ship Upgrades at half price. | I116: 2 | J116: 1 | R116: X | AI116: 1 | AJ116: =SUM(RC[-7]:RC[-1]) -> 1
A117: F:tG | B117: Malcolm | C117: Leader | E117: Brown Coat | F117: When you complete a Crime Job, take $500. | H117: 2 | J117: 1 | K117: X | P117: X | S117: X | AI117: 1 | AJ117: =SUM(RC[-7]:RC[-1]) -> 1
A118: F:tG | B118: Marco | C118: Leader | E118: Gun Runner | F118: You may Buy Gear with the "Explosives" or "Firearm" Keywords at half price. | H118: 2 | I118: 1 | Y118: X | AI118: 1 | AJ118: =SUM(RC[-7]:RC[-1]) -> 1
A119: F:tG | B119: Monty | C119: Leader | E119: Smuggler Extraordinaire | F119: When you complete a Smuggling Job, take $500. | H119: 2 | I119: 1 | K119: X | R119: X | S119: X | AI119: 1 | AJ119: =SUM(RC[-7]:RC[-1]) -> 1
A120: F:tG | B120: Nandi | C120: Leader | E120: Heart of Gold | F120: May Hire Crew at no cost. | H120: 1 | J120: 2 | K120: X | U120: X | AI120: 1 | AJ120: =SUM(RC[-7]:RC[-1]) -> 1
A121: F:tG | B121: Womack | C121: Leader | E121: Cold and Heartless | F121: When you complete an Immoral Job take $500. | H121: 2 | J121: 1 | S121: X | AI121: 1 | AJ121: =SUM(RC[-7]:RC[-1]) -> 1
A122: PBH | B122: Jubal Early | C122: Leader | E122: Bounty Hunter | F122: +2 Fight when Attacking in SHOWDOWN. May Cary 2 Gear. | H122: 1 | I122: 1 | J122: 1 | P122: X | AI122: 1 | AJ122: =SUM(RC[-7]:RC[-1]) -> 1
A123: PBH | B123: Sash | C123: Leader | E123: Pirate | F123: When you complete a Piracy Job, steal $500 from the targeted Rival. | I123: 1 | J123: 2 | X123: X | AI123: 1 | AJ123: =SUM(RC[-7]:RC[-1]) -> 1
A124: BS | B124: Hull-Mounted Flak Gun | C124: Ship Upgrade | D124: 400 | F124: When in a Sector with a Reaver Cutter, discard to ignore Reaver Cutter's effects and move that Reaver Cutter 1 Sector within Rim or Border Space | AH124: 2 | AJ124: =SUM(RC[-7]:RC[-1]) -> 2
A125: BS | B125: Long-Range Scanner Array | C125: Ship Upgrade | D125: 800 | F125: During a Fly Action you may resolve Reaver or Alliance Alert Tokens in adjacent Sectors. | AH125: 1 | AJ125: =SUM(RC[-7]:RC[-1]) -> 1
A126: BS | B126: Reaver-Flage | C126: Ship Upgrade | D126: 600 | F126: Ship may move into a Sector occupied by a Reaver Ship. Discard after loosing any Crew to the Reavers. | AH126: 2 | AJ126: =SUM(RC[-7]:RC[-1]) -> 2
A127: BS | B127: Modded Fuel Catalyzer | C127: Ship Upgrade | D127: 600 | F127: When initiating a Full Burn, Spend 1 additional Fuel to add +2 to your Drive Core's Max Range this turn. | G127: Range=2 Fuel=1 | AH127: 1 | AJ127: =SUM(RC[-7]:RC[-1]) -> 1
A128: F:tG | B128: Cargo Hold | C128: Ship Upgrade | D128: 600 | E128: Exterior Cargo Pods | F128: 2 Additional Cargo Hold areas. | G128: Cargo=2 | AG128: 2 | AJ128: =SUM(RC[-7]:RC[-1]) -> 2
A129: F:tG | B129: Cry Baby | C129: Ship Upgrade | D129: 400 | F129: When in a Sector with Alliance Cruiser, discard to ignore Alliance Cruiser's effects and move the Cruiser 1 Sector within Alliance Space. | AC129: 2 | AD129: 2 | AF129: 1 | AJ129: =SUM(RC[-7]:RC[-1]) -> 5
A130: F:tG | B130: Expanded Crew Quarters | C130: Ship Upgrade | D130: 600 | F130: +3 to Ship's Max Crew | G130: Crew=3 | AG130: 2 | AJ130: =SUM(RC[-7]:RC[-1]) -> 2
A131: F:tG | B131: Full Tune-Up & Retro-Fit | C131: Ship Upgrade | D131: 800 | F131: Ignore all Breakdowns. | AG131: 1 | AJ131: =SUM(RC[-7]:RC[-1]) -> 1
A132: F:tG | B132: Fully Equipped Med Bay | C132: Ship Upgrade | D132: 600 | F132: May re-roll Medic Checks. | AG132: 2 | AJ132: =SUM(RC[-7]:RC[-1]) -> 2
A133: F:tG | B133: Onboard Chop Shop | C133: Ship Upgrade | D133: 1600 | F133: After any Salvage Op, take $500 and Load 1 Contraband. | AF133: 2 | AJ133: =SUM(RC[-7]:RC[-1]) -> 2
A134: F:tG | B134: Overcharged Grav Thrusters | C134: Ship Upgrade | D134: 1000 | F134: +1 to Full Burn Range. | G134: Range=1 | AF134: 1 | AJ134: =SUM(RC[-7]:RC[-1]) -> 1
A135: F:tG | B135: Shiny New State-of-the-Art Compression Coils | C135: Ship Upgrade | D135: 1600 | F135: May Mosey up to 2 Sectors. Ignore all Breakdowns. | G135: Mosey=2 | AG135: 1 | AJ135: =SUM(RC[-7]:RC[-1]) -> 1
A136: F:tG | B136: Sky Hook | C136: Ship Upgrade | D136: 600 | F136: Requires Pilot to use. After completing a Crime Job, Load 1 Contraband. | Y136: X | AF136: 2 | AJ136: =SUM(RC[-7]:RC[-1]) -> 2
A137: F:tG | B137: Stash | C137: Ship Upgrade | D137: 1000 | E137: Concealed Smuggling Compartments | F137: 2 Additional Stash areas. Up to 2 Crew Onboard Ship may ingnore Alliance Wanted Crew rolls. | G137: Stash=2 | AF137: 2 | AJ137: =SUM(RC[-7]:RC[-1]) -> 2
A138: PBH | B138: Booby Trap | C138: Ship Upgrade | D138: 600 | F138: -2 to Rival's Tech Boarding Tests. If Rival rolls a 1 when Boarding your ship, 1 of their Crew is Killed. Discard to count as EXPLOSIVES. | AB138: D | AD138: 2 | AJ138: =SUM(RC[-7]:RC[-1]) -> 2
A139: PBH | B139: Cryo Stasis Chamber | C139: Ship Upgrade | D139: 600 | F139: Rivals may not Jump your Bounties. 1 Crew aboard ship may ignore Alliance Wanted Crew Rolls. | AD139: 1 | AJ139: =SUM(RC[-7]:RC[-1]) -> 1
A140: PBH | B140: Electronic Defense Suite | C140: Ship Upgrade | D140: 800 | F140: Rivals boarding your ship may not use Tech Skill for Boarding Tests. Spend 1 Fuel to Evade Reaver Cutter. Ignore the effects of either the Reaver Cutter Nav Card or Contact Event. | AG140: 2 | AJ140: =SUM(RC[-7]:RC[-1]) -> 2
A141: PBH | B141: EVA Suit | C141: Ship Upgrade | D141: 600 | F141: +1 Tech for Boarding Tests. +1 Cargo from Salvage Op. 1 Crew aboard ship may ignore Alliance Wanted Crew rolls. | AC141: 2 | AJ141: =SUM(RC[-7]:RC[-1]) -> 2
A142: PBH | B142: Mag-Grappler Launchers | C142: Ship Upgrade | D142: 800 | F142: +3 Tech for Boarding Tests. After Salvage Op, Roll: Tech 8 - 1-7: Nothing Shiny. 8+ Take 1 Ship Upgrade from any discard pile. | AF142: 1 | AJ142: =SUM(RC[-7]:RC[-1]) -> 1
A143: BS | B143: Xùnsù Whisper X1 | C143: Drive Upgrade | D143: 1600 | F143: Range: 6. 1 Fuel to initiate Full Burn. Whenever a Reaver or Alliance Ship enters your current Sector, you may immediately roll a Dice: 1-2: No effect 3-6: Evade | G143: Range=6 Fuel=1 | AH143: 1 | AJ143: =SUM(RC[-7]:RC[-1]) -> 1
A144: F:tG | B144: Enhanced Graviton Accelerator | C144: Drive Upgrade | D144: 2400 | F144: Range: 6. 1 Fuel to Initiate Full Burn. May Mosey up to 2 Sectors. Ignore all Breakdowns. | G144: Range=6 Fuel=1 | AG144: 1 | AJ144: =SUM(RC[-7]:RC[-1]) -> 1
A145: F:tG | B145: Hyper-Efficient Radion Accelerator Mark III | C145: Drive Upgrade | D145: 800 | F145: Range: 4. No fuel required to Initiate Full Burn. | G145: Range=4 Fuel=0 | AG145: 2 | AJ145: =SUM(RC[-7]:RC[-1]) -> 2
A146: F:tG | B146: Modified Radion Accelerator Mark II | C146: Drive Upgrade | D146: 1200 | F146: Range: 6. 1 Fuel to Initiate Full Burn. | G146: Range=6 Fuel=1 | AG146: 2 | AJ146: =SUM(RC[-7]:RC[-1]) -> 2
A147: F:tG | B147: Radion Accelerator Mark I | C147: Drive Core | F147: Range: 5. 1 Fuel to initiate Full Burn. | G147: Range=5 Fuel=1 | AI147: 4 | AJ147: =SUM(RC[-7]:RC[-1]) -> 4
A148: AD | B148: Modified Radion Accelerator Mark II | C148: Drive Core | F148: Range: 6. 1 Fuel to initiate Full Burn. | G148: Range=6 Fuel=1 | AI148: 1 | AJ148: =SUM(RC[-7]:RC[-1]) -> 1
A149: PBH | B149: Echelon LR-8 Drive Core | C149: Drive Core | F149: Range: 8. No Fuel required to initiate Full Burn. Cannot be replaced. | G149: Range=8 Fuel=0 | AI149: 1 | AJ149: =SUM(RC[-7]:RC[-1]) -> 1
A150: PBH | B150: Tri-Capissen 28HD | C150: Drive Core | F150: Unique Core: May not be replaced. May only be used on S.S. Walden. Range: 4. Immune to Heavy Load penalty. | G150: Range=4 Fuel=1 | AI150: 1 | AJ150: =SUM(RC[-7]:RC[-1]) -> 1

Sheet: Jobs
A1: Source | B1: Contact | C1: Name | D1: Legal | E1: Immoral | F1: Type | G1: Location 1 | H1: Misbehave 1 | I1: Details | J1: Location 2 | K1: Misbehave 2 | L1: Details | M1: Distance | N1: Pay | O1: Extra Pay | P1: Bonus Profession | Q1: Bonus Value | R1: Bonus Type | S1: Fight | T1: Tech | U1: Talk | V1: Special
A2: F:tG | B2: Amnon Duul | C2: Some discretion is required | D2: No | E2: No | F2: Smuggling | G2: Sihnon, White Sun | H2: 1 | I2: 1 Contra | J2: Boros, Georgia | L2: 1 Contra | N2: 2200 | U2: 2
A3: F:tG | B3: Amnon Duul | C3: Feeding Alliance fat cats | D3: Yes | E3: No | F3: Shipping | G3: Harvest, Red Sun | I3: 2 Cargo | J3: Albion, White Sun | L3: 2 Cargo | N3: 1500 | P3: Companion | Q3: 500 | R3: $ | U3: 2
A4: F:tG | B4: Amnon Duul | C4: Zir Com deliveries: priority mail run | D4: Yes | E4: No | F4: Shipping | G4: Space Bazaar, Red Sun | I4: 2 Cargo | J4: Ariel, White Sun | L4: 2 Cargo | N4: 1300 | P4: Soldier | Q4: 300 | R4: $ | S4: 2 | T4: 2
A5: F:tG | B5: Amnon Duul | C5: Zir Com deliveries: priority mail run | D5: Yes | E5: No | F5: Shipping | G5: Space Bazaar, Red Sun | I5: 2 Cargo | J5: Athens, Georgia | L5: 2 Cargo | N5: 1300 | P5: Soldier | Q5: 300 | R5: $ | S5: 2 | T5: 2
A6: F:tG | B6: Amnon Duul | C6: Feeding Alliance fat cats | D6: Yes | E6: No | F6: Shipping | G6: Harvest, Red Sun | I6: 2 Cargo | J6: Bellerophon, White Sun | L6: 2 Cargo | N6: 1300 | P6: Companion | Q6: 500 | R6: $ | U6: 2
A7: F:tG | B7: Amnon Duul | C7: Irrigation supply run | D7: Yes | E7: No | F7: Shipping | G7: Osiris, White Sun | I7: 2 Cargo | J7: Harvest, Red Sun | L7: 2 Cargo | N7: 1200 | P7: Mechanic | Q7: 1 | R7: Part | T7: 2
A8: F:tG | B8: Amnon Duul | C8: Zir Com deliveries: priority mail run | D8: Yes | E8: No | F8: Shipping | G8: Space Bazaar, Red Sun | I8: 2 Cargo | J8: Hera, Murphy | L8: 2 Cargo | N8: 1400 | P8: Soldier | Q8: 300 | R8: $ | S8: 2 | T8: 2
A9: F:tG | B9: Amnon Duul | C9: Feeding Alliance fat cats | D9: Yes | E9: No | F9: Shipping | G9: Harvest, Red Sun | I9: 2 Cargo | J9: Londinium, White Sun | L9: 2 Cargo | N9: 1300 | P9: Companion | Q9: 500 | R9: $ | U9: 2
A10: F:tG | B10: Amnon Duul | C10: Haulin' military scrap | D10: Yes | E10: No | F10: Shipping | G10: Hera, Murphy | I10: 2 Cargo | J10: Persephone, Lux | L10: 2 Cargo | N10: 1500 | P10: Mechanic | Q10: 1 | R10: Part | T10: 2
A11: F:tG | B11: Amnon Duul | C11: Zir Com deliveries: priority mail run | D11: Yes | E11: No | F11: Shipping | G11: Space Bazaar, Red Sun | I11: 2 Cargo | J11: Priam, Georgia | L11: 2 Cargo | N11: 1400 | P11: Soldier | Q11: 300 | R11: $ | S11: 2 | T11: 2
A12: F:tG | B12: Amnon Duul | C12: Haulin' military scrap | D12: Yes | E12: No | F12: Shipping | G12: Hera, Murphy | I12: 2 Cargo | J12: Space Bazaar, Red Sun | L12: 2 Cargo | N12: 1500 | P12: Mechanic | Q12: 1 | R12: Part | T12: 2
A13: F:tG | B13: Amnon Duul | C13: Stolen goods is still stolen | D13: No | E13: No | F13: Smuggling | G13: Gonghe, White Sun | H13: 1 | I13: 2 Contra | J13: Anson's World, Red Sun | L13: 2 Contra | N13: 2200 | P13: Soldier | Q13: 300 | R13: $ | T13: 2
A14: F:tG | B14: Amnon Duul | C14: Gun running: special order | D14: No | E14: No | F14: Smuggling | G14: Londinium, White Sun | H14: 2 | I14: 2 Contra | J14: Ezra, Georgia | L14: 2 Contra | N14: 2500 | P14: Soldier | Q14: 300 | R14: $ | S14: 2 | T14: 1
A15: F:tG | B15: Amnon Duul | C15: Gun running: Jiangyin | D15: No | E15: No | F15: Smuggling | G15: Santo, Qin Shi Huang | H15: 1 | I15: 2 Contra | J15: Jiangyin, Red Sun | L15: 2 Contra | N15: 2000 | P15: Soldier | Q15: 300 | R15: $ | S15: 2
A16: F:tG | B16: Amnon Duul | C16: Hot cargo for cold settlers | D16: No | E16: No | F16: Smuggling | G16: Silverhold, Heinlein | H16: 2 | I16: 2 Contra | J16: Newhope, Georgia | L16: 2 Contra | N16: 2500 | P16: Medic | Q16: 400 | R16: $ | S16: 2 | V16: Remove Disrguntled from all Moral Crew.
A17: BA | B17: Amnon Duul | C17: Special delivery: Classified tech | D17: No | E17: No | F17: Smuggling | G17: Sihnon, White Sun | H17: 1 | I17: 2 Contra | J17: Regina, Georgia | L17: 2 Contra | N17: 800 | O17: 400/Tech | T17: 2
A18: BA | B18: Amnon Duul | C18: Special delivery: Special prototype | D18: No | E18: No | F18: Smuggling | G18: Bernadette, White Sun | H18: 1 | I18: 2 Contra | J18: Silverhold, Heinlein | L18: 2 Contra | M18: 5 | N18: 1500 | O18: 300/Tech | T18: 2
A19: F:tG | B19: Amnon Duul | C19: Gun running: Three Hills | D19: No | E19: No | F19: Smuggling | G19: Persephone, Lux | H19: 1 | I19: 2 Contra | J19: Three Hills, Georgia | L19: 2 Contra | N19: 2200 | P19: Soldier | Q19: 300 | R19: $ | S19: 2
A20: F:tG | B20: Amnon Duul | C20: Worker & equipment transport | D20: Yes | E20: No | F20: Transport | G20: Greenleaf, Red Sun | I20: 2 Pass, 2 Parts | J20: Hera, Murphy | L20: 2 Pass, 2 Parts | N20: 1500 | P20: Mechanic | Q20: 1 | R20: Part | T20: 2
A21: F:tG | B21: Amnon Duul | C21: Heavy load! Motherlode ore | D21: Yes | E21: No | F21: Shipping | G21: Motherlode, Red Sun | I21: 3 Cargo | J21: Albion, White Sun | L21: 3 Cargo | N21: 1900 | V21: Heavy Load
A22: F:tG | B22: Amnon Duul | C22: Heavy load! Motherlode ore | D22: Yes | E22: No | F22: Shipping | G22: Motherlode, Red Sun | I22: 3 Cargo | J22: Bernadette, White Sun | L22: 3 Cargo | N22: 1900 | V22: Heavy Load
A23: F:tG | B23: Amnon Duul | C23: Heavy load! Motherlode ore | D23: Yes | E23: No | F23: Shipping | G23: Motherlode, Red Sun | I23: 3 Cargo | J23: Boros, Georgia | L23: 3 Cargo | N23: 2200 | V23: Heavy Load
A24: F:tG | B24: Amnon Duul | C24: Courting Aprhodite | D24: No | E24: No | F24: Smuggling | G24: Space Bazaar, Red Sun | I24: 2 Contra | J24: Aphrodite, Murphy | K24: 1 | L24: 2 Contra | N24: 2000 | P24: Grifter | Q24: 500 | R24: $ | V24: Negotiate
A25: F:tG | B25: Amnon Duul | C25: Courting Kerry | D25: No | E25: No | F25: Smuggling | G25: Space Bazaar, Red Sun | I25: 2 Contra | J25: Kerry, Georgia | K25: 1 | L25: 2 Contra | N25: 2000 | P25: Grifter | Q25: 500 | R25: $ | V25: Negotiate
A26: F:tG | B26: Amnon Duul | C26: Courting Regina | D26: No | E26: No | F26: Smuggling | G26: Space Bazaar, Red Sun | I26: 2 Contra | J26: Regina, Georgia | K26: 1 | L26: 2 Contra | N26: 2000 | P26: Grifter | Q26: 500 | R26: $ | V26: Negotiate
A27: F:tG | B27: Amnon Duul | C27: Homesteader transport | D27: Yes | E27: No | F27: Transport | G27: Space Bazaar, Red Sun | I27: Pass, no limit | J27: Ithaca, Georgia | L27: Pass, no limit | N27: 200/P | P27: Medic | Q27: 400 | R27: $ | S27: 1 | T27: 2
A28: F:tG | B28: Amnon Duul | C28: Homesteader transport | D28: Yes | E28: No | F28: Transport | G28: Space Bazaar, Red Sun | I28: Pass, no limit | J28: Three Hills, Georgia | L28: Pass, no limit | N28: 200/P | P28: Medic | Q28: 400 | R28: $ | S28: 2
A29: BA | B29: Amnon Duul | C29: Zir Com franchising: UAP transport hub | D29: Yes | E29: No | F29: Task | G29: Ariel, White Sun | N29: 400 | O29: 400/Talk | P29: Companion | Q29: 500 | R29: $ | U29: 2
A30: BA | B30: Amnon Duul | C30: Zir Com franchising: Tanis Docks | D30: Yes | E30: No | F30: Task | G30: Osiris, White Sun | N30: 400 | O30: 400/Talk | P30: Companion | Q30: 500 | R30: $ | U30: 2
A31: BA | B31: Amnon Duul | C31: Zir Com franchising: Bachofen Docks | D31: Yes | E31: No | F31: Task | G31: Hera, Murphy | N31: 800 | O31: 400/Talk | P31: Grifter | Q31: 500 | R31: $ | U31: 2
A32: F:tG | B32: Badger | C32: Making the love connection | D32: Yes | E32: No | F32: Transport | G32: Sihnon, White Sun | I32: 1 Pass | J32: Boros, Georgia | L32: 1 Pass | N32: 1800 | P32: Companion | Q32: 500 | R32: $ | S32: 2 | U32: 1
A33: F:tG | B33: Badger | C33: Bilking the yokels | D33: Yes | E33: No | F33: Shipping | G33: Albion, White Sun | I33: 2 Cargo | J33: Brisingamnen, Himinbjorg | L33: 2 Cargo | M33: 7 | N33: 1500 | P33: Grifter | Q33: 500 | R33: $ | V33: Wheel and Deal (500)
A34: F:tG | B34: Badger | C34: On the up and up, I swear! | D34: Yes | E34: No | F34: Shipping | G34: Londinium, White Sun | I34: 2 Cargo | J34: Ezra, Georgia | L34: 2 Cargo | N34: 1500 | P34: Grifter | Q34: 500 | R34: $ | V34: Wheel and Deal (500)
A35: F:tG | B35: Badger | C35: Keep your noses clean | D35: Yes | E35: No | F35: Shipping | G35: Ariel, White Sun | I35: 2 Cargo | J35: Harvest, Red Sun | L35: 2 Cargo | M35: 7 | N35: 1500 | P35: Grifter | Q35: 500 | R35: $ | V35: Wheel and Deal (500)
A36: F:tG | B36: Badger | C36: Playing the middleman | D36: Yes | E36: No | F36: Shipping | G36: Athens, Georgia | I36: 2 Cargo | J36: Space Bazaar, Red Sun | L36: 2 Cargo | M36: 7 | N36: 1800 | V36: Wheel and Deal (500)
A37: F:tG | B37: Badger | C37: Hard goods for hard times | D37: Yes | E37: No | F37: Shipping | G37: Persephone, Lux | I37: 2 Cargo | J37: Three Hills, Georgia | L37: 2 Cargo | N37: 1500 | P37: Grifter | Q37: 500 | R37: $ | V37: Wheel and Deal (500)
A38: F:tG | B38: Badger | C38: Slave wrangling | D38: No | E38: Yes | F38: Transport | G38: Persephone, Lux | H38: 1 | I38: 3 Fugi | J38: Aphrodite, Murphy | L38: 3 Fugi | N38: 2500 | P38: Soldier | Q38: 300 | R38: $ | S38: 2
A39: F:tG | B39: Badger | C39: Send them to the ruttin' mines! | D39: No | E39: Yes | F39: Transport | G39: Persephone, Lux | H39: 1 | I39: 3 Fugi | J39: Silverhold, Heinlein | L39: 3 Fugi | N39: 2500 | P39: Soldier | Q39: 300 | R39: $ | S39: 2
A40: F:tG | B40: Badger | C40: Breaking into new markets | D40: Yes | E40: No | F40: Transport | G40: Persephone, Lux | I40: 3 Pass | J40: Jubilee, Red Sun | L40: 3 Pass | N40: 1500 | P40: Soldier | Q40: 300 | R40: $ | S40: 1 | T40: 1
A41: F:tG | B41: Badger | C41: Time for a fancy shindig | D41: No | E41: No | F41: Smuggling | G41: Persephone, Lux | H41: 2 | I41: 4 Contra | J41: Regina, Georgia | L41: 4 Contra | N41: 3000 | P41: Companion | Q41: 500 | R41: $ | U41: 2 | V41: Fancy Duds
A42: F:tG | B42: Badger | C42: Pushing drops | D42: No | E42: Yes | F42: Smuggling | G42: Valentine, White Sun | I42: 1 Contra | J42: Aphrodite, Murphy | K42: 1 | L42: 1 Contra | N42: 2500 | P42: Grifter | Q42: 500 | R42: $ | U42: 2
A43: BA | B43: Badger | C43: Data jacking | D43: No | E43: No | F43: Smuggling | G43: Londinium, White Sun | H43: 2 | I43: 1 Contra | J43: Ezra, Georgia | K43: 1 | L43: 1 Contra | N43: 1000 | O43: 500/Tech | T43: 2 | V43: Hacking Rig
A44: F:tG | B44: Badger | C44: Try one of the border planets | D44: No | E44: No | F44: Smuggling | G44: Persephone, Lux | I44: 2 Contra | J44: Athens, Georgia | K44: 1 | L44: 2 Contra | N44: 2500 | P44: Soldier | Q44: 300 | R44: $ | S44: 1 | U44: 1
A45: F:tG | B45: Badger | C45: Sowing chaos | D45: No | E45: No | F45: Transport | G45: Space Bazaar, Red Sun | I45: Fugi, no limit | J45: Albion, White Sun | K45: 1 | L45: Fugi, no limit | N45: 300/F | S45: 1 | T45: 1 | U45: 1
A46: F:tG | B46: Badger | C46: Raising funds at the fundraising | D46: No | E46: No | F46: Crime | G46: Bellerophon, White Sun | H46: 2 | N46: 2800 | P46: Companion | Q46: 500 | R46: $ | U46: 2 | V46: Fancy Duds
A47: BA | B47: Badger | C47: Filling up their dance cards | D47: No | E47: No | F47: Crime | G47: Santo, Qin Shi Huang | H47: 2 | N47: 500 | O47: 500/Talk | P47: Companion | Q47: 500 | R47: $ | U47: 2
A48: F:tG | B48: Badger | C48: Badger's 11 casino caper | D48: No | E48: No | F48: Crime | G48: Santo, Qin Shi Huang | H48: 3 | N48: 3500 | P48: Companion | Q48: 500 | R48: $ | S48: 1 | T48: 1 | U48: 1
A49: BA | B49: Badger | C49: Talkin' all respectable-like | D49: No | E49: No | F49: Crime | G49: Aesir, Himinbjorg | H49: 2 | N49: 500 | O49: 500/Talk | P49: Grifter | Q49: 500 | R49: $ | U49: 2
A50: BA | B50: Badger | C50: Delaying the dive | D50: No | E50: No | F50: Crime | G50: Aphrodite, Murphy | H50: 2 | N50: 500 | O50: 500/Talk | P50: Grifter | Q50: 500 | R50: $ | U50: 2
A51: F:tG | B51: Badger | C51: Takes my breath away | D51: No | E51: Yes | F51: Crime | G51: Hera, Murphy | H51: 3 | N51: 3500 | P51: Mechanic | Q51: 1 | R51: Part | V51: Transport
A52: F:tG | B52: Badger | C52: The hospital job | D52: No | E52: No | F52: Crime | G52: Ariel, White Sun | H52: 3 | N52: 3500 | P52: Medic | Q52: 400 | R52: $ | T52: 2 | U52: 2 | V52: Fake ID
A53: F:tG | B53: Badger | C53: Diamonds the size of testicles… | D53: No | E53: No | F53: Crime | G53: Kerry, Georgia | H53: 3 | N53: 3500 | P53: Soldier | Q53: 300 | R53: $ | S53: 2 | V53: Explosives
A54: BA | B54: Badger | C54: Street sweepers | D54: No | E54: No | F54: Crime | G54: Persephone, Lux | H54: 3 | N54: 300 | O54: 300/Fight | P54: Soldier | Q54: 300 | R54: $ | S54: 2
A55: F:tG | B55: Badger | C55: Withdraw from the 1st Bank & Trust | D55: No | E55: no | F55: Crime | G55: St. Alban's, Red Sun | H55: 2 | N55: 4000 | P55: Soldier | Q55: 300 | R55: $ | V55: Crack the Safe
A56: F:tG | B56: Badger | C56: Losing patience with Patience… | D56: No | E56: No | F56: Crime | G56: Athens, Georgia | H56: 2 | N56: 3000 | V56: Cover Your Tracks
A57: F:tG | B57: Badger | C57: Poking holes in Niska's plan | D57: No | E57: No | F57: Crime | G57: Ezra, Georgia | H57: 2 | N57: 3000 | V57: Cover Your Tracks
A58: F:tG | B58: Badger | C58: The Alliance payroll caper | D58: No | E58: No | F58: Crime | G58: Jiangyin, Red Sun | H58: 3 | N58: 3500 | V58: Transport
A59: F:tG | B59: Badger | C59: Offload the motherlode | D59: No | E59: No | F59: Crime | G59: Motherlode, Red Sun | H59: 2 | N59: 2800 | S59: 1 | T59: 2
A60: F:tG | B60: Badger | C60: Hump 'em, let 'em twist! | D60: No | E60: No | F60: Crime | G60: Silverhold, Heinlein | H60: 2 | N60: 2800 | T60: 2 | V60: Hacking Rig
A61: F:tG | B61: Badger | C61: Procure the postman's parcel | D61: No | E61: No | F61: Crime | G61: Space Bazaar, Red Sun | H61: 2 | N61: 3000 | V61: Cover Your Tracks
A62: F:tG | B62: Harken | C62: Cargo delivery: Osiris | D62: Yes | E62: No | F62: Shipping | G62: Londinium, White Sun | I62: 1 Cargo | J62: Osiris, White Sun | L62: 1 Cargo | N62: 600
A63: F:tG | B63: Harken | C63: Cargo delivery: Sihnon | D63: Yes | E63: No | F63: Shipping | G63: Londinium, White Sun | I63: 1 Cargo | J63: Sihnon, White Sun | L63: 1 Cargo | N63: 600
A64: F:tG | B64: Harken | C64: Medical emergency transport | D64: Yes | E64: No | F64: Transport | G64: Santo, Qin Shi Huang | I64: 1 Pass | J64: Ariel, White Sun | L64: 1 Pass | N64: 700 | P64: Medic | Q64: 400 | R64: $
A65: F:tG | B65: Harken | C65: Scrap hauling: Aesir | D65: Yes | E65: No | F65: Shipping | G65: Londinium, White Sun | I65: 2 Cargo | J65: Aesir, Himinbjorg | L65: 2 Cargo | N65: 900 | P65: Mechanic | Q65: 1 | R65: Part
A66: F:tG | B66: Harken | C66: Cargo delivery: Albion | D66: Yes | E66: No | F66: Shipping | G66: Sihnon, White Sun | I66: 2 Cargo | J66: Albion, White Sun | L66: 2 Cargo | N66: 600
A67: F:tG | B67: Harken | C67: Cargo delivery: Ariel | D67: Yes | E67: No | F67: Shipping | G67: Sihnon, White Sun | I67: 2 Cargo | J67: Ariel, White Sun | L67: 2 Cargo | N67: 600
A68: F:tG | B68: Harken | C68: Vital supplies: Jubilee | D68: Yes | E68: No | F68: Shipping | G68: Londinium, White Sun | I68: 2 Cargo | J68: Jubilee, Red Sun | L68: 2 Cargo | N68: 900 | P68: Soldier | Q68: 300 | R68: $ | S68: 1
A69: F:tG | B69: Harken | C69: Vital supplies: Hera | D69: Yes | E69: No | F69: Shipping | G69: Londinium, White Sun | I69: 2 Cargo | J69: Kerry, Georgia | L69: 2 Cargo | N69: 900 | P69: Soldier | Q69: 300 | R69: $ | S69: 1
A70: F:tG | B70: Harken | C70: Relief supplies: Newhope | D70: Yes | E70: No | F70: Shipping | G70: Londinium, White Sun | I70: 2 Cargo | J70: Newhope, Georgia | L70: 2 Cargo | N70: 900 | P70: Medic | Q70: 400 | R70: $
A71: F:tG | B71: Harken | C71: Scrap hauling: Space Bazaar | D71: Yes | E71: No | F71: Shipping | G71: Londinium, White Sun | I71: 2 Cargo | J71: Space Bazaar, Red Sun | L71: 2 Cargo | N71: 700 | P71: Mechanic | Q71: 1 | R71: Part
A72: F:tG | B72: Harken | C72: Relief supplies: St. Albans | D72: Yes | E72: No | F72: Shipping | G72: Londinium, White Sun | I72: 2 Cargo | J72: St. Albans, Red Sun | L72: 2 Cargo | N72: 900 | P72: Medic | Q72: 400 | R72: $
A73: F:tG | B73: Harken | C73: Cargo delivery: Valentine | D73: Yes | E73: No | F73: Shipping | G73: Sihnon, White Sun | I73: 2 Cargo | J73: Valentine, White Sun | L73: 2 Cargo | N73: 600
A74: F:tG | B74: Harken | C74: Laborer transport | D74: Yes | E74: No | F74: Transport | G74: Bellerophon, White Sun | I74: 2 Pass | J74: Albion, White Sun | L74: 2 Pass | M74: 3 | N74: 700
A75: F:tG | B75: Harken | C75: University student transport | D75: Yes | E75: No | F75: Transport | G75: Persephone, Lux | I75: 2 Pass | J75: Osiris, White Sun | L75: 2 Pass | N75: 700 | P75: Companion | Q75: 500 | R75: $
A76: F:tG | B76: Harken | C76: Vacationers to Pelorum | D76: Yes | E76: No | F76: Transport | G76: Albion, White Sun | I76: 2 Pass | J76: Pelorum, Lux | L76: 2 Pass | M76: 5 | N76: 700 | P76: Companion | Q76: 500 | R76: $
A77: F:tG | B77: Harken | C77: Forced settler relocation | D77: Yes | E77: Yes | F77: Transport | G77: Valentine, White Sun | I77: 2 Pass, 1 Cargo | J77: Anson's World, Red Sun | L77: 2 Pass, 1 Cargo | N77: 900 | P77: Soldier | Q77: 300 | R77: $ | S77: 2
A78: F:tG | B78: Harken | C78: Forced settler relocation | D78: Yes | E78: Yes | F78: Transport | G78: Sihnon, White Sun | I78: 2 Pass, 1 Cargo | J78: Aphrodite, Murphy | L78: 2 Pass, 1 Cargo | N78: 900 | P78: Soldier | Q78: 300 | R78: $ | S78: 2
A79: F:tG | B79: Harken | C79: Forced settler relocation | D79: Yes | E79: Yes | F79: Transport | G79: Londinium, White Sun | I79: 2 Pass, 1 Cargo | J79: Brisingamnen, Himinbjorg | L79: 2 Pass, 1 Cargo | N79: 900 | P79: Soldier | Q79: 300 | R79: $ | S79: 2
A80: F:tG | B80: Harken | C80: Settlers to New Melbourne | D80: Yes | E80: No | F80: Transport | G80: Bernadette, White Sun | I80: 2 Pass, 1 Cargo | J80: New Melbourne, Red Sun | L80: 2 Pass, 1 Cargo | M80: 6 | N80: 900
A81: F:tG | B81: Harken | C81: Settlers to Regina | D81: Yes | E81: No | F81: Transport | G81: Liann Jiun, White Sun | I81: 2 Pass, 1 Cargo | J81: Regina, Georgia | L81: 2 Pass, 1 Cargo | N81: 900
A82: F:tG | B82: Harken | C82: Forced settler relocation | D82: Yes | E82: Yes | F82: Transport | G82: Gonghe, White Sun | I82: 2 Pass, 1 Cargo | J82: Three Hills, Georgia | L82: 2 Pass, 1 Cargo | N82: 900 | P82: Soldier | Q82: 300 | R82: $ | S82: 2
A83: F:tG | B83: Harken | C83: Equipment delivery: Bellerophon | D83: Yes | E83: No | F83: Shipping | G83: Osiris, White Sun | I83: 4 Parts | J83: Bellerophon, White Sun | L83: 4 Parts | N83: 600 | P83: Mechanic | Q83: 1 | R83: Part
A84: F:tG | B84: Harken | C84: Equipment delivery: Persephone | D84: Yes | E84: No | F84: Shipping | G84: Osiris, White Sun | I84: 4 Parts | J84: Persephone, Lux | L84: 4 Parts | N84: 600 | P84: Mechanic | Q84: 1 | R84: Part
A85: F:tG | B85: Harken | C85: Fuel run: Boros | D85: Yes | E85: No | F85: Shipping | G85: Londinium, White Sun | I85: 8 Fuel | J85: Boros, Georgia | L85: 8 Fuel | N85: 900
A86: F:tG | B86: Harken | C86: Fuel run: Silverhold | D86: Yes | E86: No | F86: Shipping | G86: Londinium, White Sun | I86: 8 Fuel | J86: Silverhold, Heinlein | L86: 8 Fuel | N86: 900
A87: BA | B87: Harken | C87: Cortex relay maintenance | D87: Yes | E87: No | F87: Task | G87: Albion, White Sun | N87: 200 | O87: 200/Tech | P87: Mechanic | Q87: 1 | R87: Part | T87: 1
A88: BA | B88: Harken | C88: Cortex relay maintenance | D88: Yes | E88: No | F88: Task | G88: Valentine, White Sun | N88: 200 | O88: 200/Tech | P88: Mechanic | Q88: 1 | R88: Part | T88: 1
A89: BA | B89: Harken | C89: Riot suppression: Rancher protest | D89: Yes | E89: Yes | F89: Task | G89: Athens, Georgia | N89: 200 | O89: 200/Fight | P89: Soldier | Q89: 300 | R89: $ | S89: 1
A90: BA | B90: Harken | C90: Riot suppression: Ezra food shortage | D90: Yes | E90: Yes | F90: Task | G90: Ezra, Georgia | N90: 200 | O90: 200/Fight | P90: Soldier | Q90: 300 | R90: $ | S90: 1
A91: BA | B91: Harken | C91: Riot suppression: Dock worker strike | D91: Yes | E91: Yes | F91: Task | G91: Persephone, Lux | N91: 200 | O91: 200/Fight | P91: Soldier | Q91: 300 | R91: $ | S91: 1
A92: BS | B92: Lord Harrow | C92: 15 Tons and what do you get | D92: Yes | E92: No | F92: Shipping | G92: Uroboros Belt, Blue Sun | I92: 5 Cargo | J92: Osiris, White Sun | L92: 5 Cargo | N92: 2000 | P92: Soldier | Q92: 300 | R92: $ | V92: Heavy Load
A93: BS | B93: Lord Harrow | C93: Miranda's Promise | D93: No | E93: No | F93: Smuggling | G93: Miranda, Burnham | I93: Goods | J93: Highgate, Blue Sun | K93: 1 | L93: 2 Cargo | N93: 2000 | V93: Tag & Bag
A94: BS | B94: Lord Harrow | C94: Guess I'm Just a good man | D94: No | E94: No | F94: Smuggling | G94: Dragon's Egg, Blue Sun | H94: 2 | I94: 4 Contraband | J94: Athens, Georgia | L94: 4 Contra | N94: 3600 | V94: Shootout
A95: BS | B95: Lord Harrow | C95: The Uroboros Run | D95: No | E95: No | F95: Smuggling | G95: Uroboros Belt, Blue Sun | I95: 5 Contra | J95: Ezra, Georgia | K95: 2 | L95: 5 Contra | N95: 3000 | P95: Soldier | Q95: 300 | R95: $ | V95: Heavy Load
A96: BS | B96: Lord Harrow | C96: Muss Up the Spoiled Dandy | D96: No | E96: no | F96: Smuggling | G96: Deadwood, Blue Sun | H96: 2 | I96: 3 Contra | J96: Persephone, Lux | N96: 3000 | P96: Companion | Q96: 500 | R96: $ | V96: Tussle
A97: BS | B97: Lord Harrow | C97: Sir, I'm an Honest Man… | D97: No | E97: No | F97: Smuggling | G97: Highgate, Blue Sun | I97: 3 Contra | J97: Space Bazaar, Red Sun | K97: 2 | L97: 3 Contra | N97: 3500 | S97: 3 | U97: 3
A98: BS | B98: Lord Harrow | C98: My Work's Illegal, But it's Honest | D98: Yes | E98: No | F98: Smuggling | G98: Dragon's Egg, Blue Sun | I98: 4 Contra | J98: Regina, Georgia | K98: 1 | L98: 4 Contra | N98: 2200 | P98: Grifter | Q98: 500 | R98: $ | U98: 3
A99: BS | B99: Lord Harrow | C99: Baubles for the Ball | D99: No | E99: No | F99: Shipping | G99: Meridian, Blue Sun | I99: 4 Cargo | J99: Persephone, Lux | L99: 4 Cargo | N99: 2100 | P99: Companion | Q99: 500 | R99: $ | T99: 3
A100: BS | B100: Lord Harrow | C100: Shinies for Mudville | D100: No | E100: No | F100: Smuggling | G100: Meridian, Blue Sun | H100: 1 | I100: 4 Contra | J100: Harvest, Red Sun | L100: 4 Contra | N100: 2600 | P100: Mechanic | Q100: 1 | R100: Part | V100: Wheel & Deal
A101: BS | B101: Lord Harrow | C101: Fun with Rocks | D101: No | E101: No | F101: Smuggling | G101: Uroboros Belt, Blue Sun | I101: 5 Contra | J101: Athens, Georgia | K101: 2 | L101: 5 Contra | N101: 3000 | P101: Soldier | Q101: 300 | R101: $ | V101: Heavy Load
A102: BS | B102: Lord Harrow | C102: Miranda's Secret | D102: No | E102: No | F102: Smuggling | G102: Miranda, Burnham | I102: Goods | J102: Meridian, Blue Sun | K102: 1 | L102: 2 Cargo | N102: 2000 | V102: Tag & Bag
A103: BS | B103: Lord Harrow | C103: Warrick's Request | D103: No | E103: No | F103: Smuggling | G103: Highgate, Blue Sun | I103: 3 Contra | J103: Osiris, White Sun | K103: 2 | L103: 3 Contra | N103: 2400 | P103: Mechanic | Q103: 1 | R103: Part | T103: 3 | U103: 1
A104: BS | B104: Lord Harrow | C104: Hungry for Beefsteak | D104: No | E104: No | F104: Smuggling | G104: Persephone, Lux | I104: 4 Contra | J104: Jiangyin, Red Sun | K104: 2 | L104: 4 Contra | N104: 3200 | P104: Companion | Q104: 500 | R104: $ | V104: Fancy Duds
A105: BS | B105: Lord Harrow | C105: Goods to People what need Them | D105: No | E105: No | F105: Smuggling | G105: Deadwood, Blue Sun | I105: 4 Contra | J105: Harvest, Red Sun | K105: 1 | L105: 4 Contra | N105: 2800 | P105: Mechanic | Q105: 1 | R105: Part | T105: 3
A106: BS | B106: Lord Harrow | C106: Delicate Dealings | D106: No | E106: No | F106: Smuggling | G106: New Canaan, Blue Sun | I106: 4 Contra | J106: Space Bazaar, Red Sun | K106: 1 | L106: 4 Contra | N106: 2800 | P106: Grifter | Q106: 500 | R106: $ | U106: 3
A107: BS | B107: Lord Harrow | C107: Mercy is the Mark of a Great Man | D107: No | E107: No | F107: Smuggling | G107: Persephone, Lux | H107: 1 | I107: 3 Contra | J107: Shadow, Murphy | L107: 3 Contra | N107: 2300 | V107: Good Deeds
A108: BS | B108: Lord Harrow | C108: A Solid Deal | D108: No | E108: No | F108: Smuggling | G108: Fury, Blue Sun | I108: 4 Contra | J108: Space Bazaar, Red Sun | K108: 1 | L108: 4 Contra | N108: 2900 | P108: Grifter | Q108: 500 | R108: $ | S108: 3 | U108: 3
A109: BS | B109: Lord Harrow | C109: Rely on your Winning Personality | D109: No | E109: No | F109: Smuggling | G109: Meridian, Blue Sun | H109: 2 | I109: 3 Contra | J109: Regina, Georgia | L109: 3 Contra | N109: 2700 | V109: Wheel & Deal
A110: BS | B110: Lord Harrow | C110: In your hold Before Midnight | D110: No | E110: No | F110: Smuggling | G110: New Canaan, Blue Sun | H110: 2 | I110: 3 Contra | J110: Silverhold, Heinlein | L110: 3 Contra | N110: 2800 | P110: Grifter | Q110: 500 | R110: $ | V110: Tussle
A111: BS | B111: Lord Harrow | C111: Lord Harrow's Private Reserve | D111: No | E111: No | F111: Smuggling | G111: Persephone, Lux | H111: 1 | I111: 3 Contra | J111: Highgate, Blue Sun | L111: 3 Contra | N111: 3000 | P111: Companion | Q111: 500 | R111: $ | U111: 3
A112: BS | B112: Lord Harrow | C112: Another Day Older and Deeper in Debt | D112: Yes | E112: No | F112: Shipping | G112: Uroboros Belt, Blue Sun | I112: 5 Cargo | J112: Persephone, Lux | L112: 5 Cargo | N112: 2500 | V112: Heavy Load
A113: BS | B113: Lord Harrow | C113: Does this mean we're in Business? | D113: No | E113: No | F113: Smuggling | G113: Muir, Blue Sun | I113: 4 Contra | J113: Ezra, Georgia | K113: 1 | L113: 4 Contra | N113: 2800 | S113: 2 | T113: 3
A114: BS | B114: Lord Harrow | C114: A Fight Before You're Gutted | D114: No | E114: No | F114: Smuggling | G114: Fury, Blue Sun | H114: 2 | I114: 3 Contra | J114: Silverhold, Heinlein | L114: 3 Contra | N114: 3000 | P114: Soldier | Q114: 300 | R114: $ | V114: Tussle
A115: BS | B115: Lord Harrow | C115: A Favor for his Lordship | D115: No | E115: No | F115: Smuggling | G115: Highgate, Blue Sun | I115: 4 Contra | J115: Silverhold, Heinlein | K115: 1 | L115: 4 Contra | N115: 2200 | P115: Soldier | Q115: 300 | R115: $ | S115: 3
A116: BS | B116: Lord Harrow | C116: Offend the Psychotic Lowlife Community | D116: Yes | E116: No | F116: Shipping | G116: Highgate, Blue Sun | I116: 4 Cargo | J116: Persephone, Lux | L116: 4 Cargo | N116: 2000 | S116: 3
A117: F:tG | B117: Niska | C117: My wife's other nephew needs a lift | D117: No | E117: No | F117: Transport | G117: Santo, Qin Shi Huang | H117: 2 | I117: 1 Fugi | J117: Ezra, Georgia | L117: 1 Fugi | N117: 3500 | P117: Companion | Q117: 500 | R117: $ | U117: 2
A118: F:tG | B118: Niska | C118: Kidnapping for fun and profit! | D118: No | E118: Yes | F118: Transport | G118: Pelorum, Lux | H118: 2 | I118: 1 Fugi | J118: Ezra, Georgia | L118: 1 Fugi | N118: 3500 | P118: Soldier | Q118: 300 | R118: $ | S118: 2 | U118: 1
A119: BA | B119: Niska | C119: It's not business, it's personal | D119: No | E119: Yes | F119: Transport | G119: Liann Jiun, White Sun | H119: 3 | I119: 1 Fugi | J119: Ezra, Georgia | L119: 1 Fugi | N119: 2000 | O119: 200/Fight | V119: Transport
A120: F:tG | B120: Niska | C120: Stranger to a strange land | D120: No | E120: No | F120: Transport | G120: Valentine, White Sun | H120: 3 | I120: 1 Fugi | J120: Triumph, Heinlein | L120: 1 Fugi | N120: 4000 | U120: 2
A121: F:tG | B121: Niska | C121: Slave grab | D121: No | E121: Yes | F121: Transport | G121: Newhope, Georgia | H121: 2 | I121: 3 Fugi | J121: Motherlode, Red Sun | L121: 3 Fugi | N121: 3500 | P121: Medic | Q121: 400 | R121: $ | V121: Negotiate
A122: F:tG | B122: Niska | C122: From great need springs great profit | D122: No | E122: Yes | F122: Smuggling | G122: Ezra, Georgia | I122: 2 Contra | J122: Anson's World, Red Sun | K122: 1 | L122: 2 Contra | N122: 3500 | P122: Grifter | Q122: 500 | R122: $ | V122: Negotiate
A123: F:tG | B123: Niska | C123: Narcotics express | D123: No | E123: Yes | F123: Smuggling | G123: Jiangyin, Red Sun | I123: 2 Contra | J123: Osiris, White Sun | K123: 1 | L123: 2 Contra | N123: 3500 | P123: Grifter | Q123: 500 | R123: $ | V123: Negotiate
A124: F:tG | B124: Niska | C124: Pirated tech delivery | D124: No | E124: No | F124: Smuggling | G124: Aphrodite, Murphy | I124: 1 Contra | J124: Londinium, White Sun | K124: 2 | L124: 1 Contra | M124: 5 | N124: 3500 | P124: Grifter | Q124: 500 | R124: $ | T124: 2
A125: F:tG | B125: Niska | C125: Wet-ware run | D125: No | E125: Yes | F125: Transport | G125: Silverhold, Heinlein | I125: 1 Fugi | J125: Sihnon, White Sun | K125: 2 | L125: 1 Fugi | N125: 3500 | P125: Medic | Q125: 400 | R125: $ | T125: 2
A126: BA | B126: Niska | C126: The big bad Niska | D126: No | E126: Yes | F126: Transport | G126: Ezra, Georgia | I126: 5 Fugi | J126: St. Albans, Red Sun | K126: 4 | L126: 5 Fugi | N126: 400 | O126: 400/Fight | V126: Solid Rep With Niska
A127: F:tG | B127: Niska | C127: The Ariel City Museum art heist | D127: No | E127: No | F127: Crime | G127: Ariel, White Sun | H127: 3 | N127: 4000 | P127: Companion | Q127: 500 | R127: $ | T127: 1 | U127: 2 | V127: Fancy Duds
A128: F:tG | B128: Niska | C128: Inside information | D128: No | E128: No | F128: Crime | G128: Liann Jiun, White Sun | H128: 3 | N128: 4000 | P128: Companion | Q128: 500 | R128: $ | T128: 1 | U128: 2 | V128: Hacking Rig
A129: F:tG | B129: Niska | C129: Inflitrate the trade ministry | D129: No | E129: No | F129: Crime | G129: Sihnon, White Sun | H129: 4 | N129: 5000 | P129: Companion | Q129: 500 | R129: $ | V129: Fancy Duds, Hacking Rig, Fake ID
A130: BA | B130: Niska | C130: Sharking the whales | D130: No | E130: No | F130: Crime | G130: Bellerophon, White Sun | H130: 4 | N130: 2000 | O130: 500/Talk | P130: Grifter | Q130: 500 | R130: $ | U130: 2 | V130: Fancy Duds
A131: F:tG | B131: Niska | C131: A judge in Niska's pocket | D131: No | E131: No | F131: Crime | G131: Osiris, White Sun | H131: 3 | N131: 4000 | P131: Grifter | Q131: 500 | R131: $ | T131: 2 | U131: 1 | V131: Hacking Rig
A132: F:tG | B132: Niska | C132: Corporate espionage: target Blue Sun | D132: No | E132: No | F132: Crime | G132: Persephone, Lux | H132: 3 | N132: 4000 | P132: Grifter | Q132: 500 | R132: $ | T132: 2 | V132: Hacking Rig
A133: F:tG | B133: Niska | C133: Jump & hump the competition | D133: No | E133: No | F133: Crime | G133: Space Bazaar, Red Sun | H133: 3 | N133: Spec | P133: Mechanic | Q133: 1 | R133: Part | T133: 2 | V133: Pay = 1 Cargo per crew
A134: F:tG | B134: Niska | C134: Hit the relief supplies convoy | D134: No | E134: Yes | F134: Crime | G134: Aesir, Himinbjorg | H134: 3 | N134: 3500 | P134: Medic | Q134: 400 | R134: $ | T134: 2
A135: BA | B135: Niska | C135: Repo by fire | D135: No | E135: Yes | F135: Crime | G135: Greenleaf, Red Sun | H135: 3 | N135: 300 | O135: 300/Fight | P135: Soldier | Q135: 300 | R135: $ | S135: 2 | V135: Explosives
A136: F:tG | B136: Niska | C136: Protection racket: shake down Greenleaf | D136: No | E136: Yes | F136: Crime | G136: Greenleaf, Red Sun | H136: 3 | N136: 3500 | P136: Soldier | Q136: 300 | R136: $ | S136: 2 | U136: 1
A137: F:tG | B137: Niska | C137: Protection racket: shake down Jubilee | D137: No | E137: Yes | F137: Crime | G137: Jubilee, Red Sun | H137: 3 | N137: 3500 | P137: Soldier | Q137: 300 | R137: $ | S137: 2 | U137: 1
A138: F:tG | B138: Niska | C138: The train job | D138: No | E138: Yes | F138: Crime | G138: Regina, Georgia | H138: 4 | N138: 4500 | P138: Soldier | Q138: 300 | R138: $ | S138: 1 | T138: 1 | U138: 1 | V138: Transport
A139: BA | B139: Niska | C139: Moon the Alliance | D139: No | E139: No | F139: Crime | G139: Alliance Cruiser | H139: 4 | N139: 200 | O139: 500/Tech | V139: Hacking Rig, Solid Rep with Harken
A140: F:tG | B140: Niska | C140: Her majesty, the mayor of Whitefall | D140: No | E140: Yes | F140: Crime | G140: Athens, Georgia | H140: 3 | N140: 4000 | V140: Cover Your Tracks
A141: F:tG | B141: Niska | C141: Taking candy from babies | D141: No | E141: Yes | F141: Crime | G141: Brisingamen, Himinbjorg | H141: 3 | N141: 3500 | S141: 1 | T141: 1 | U141: 1
A142: F:tG | B142: Niska | C142: The Alliance Reserve bank heist | D142: No | E142: No | F142: Crime | G142: Londinium, White Sun | H142: 4 | N142: 6000 | V142: Open the Vault
A143: F:tG | B143: Niska | C143: Sad little king of a sad little hill | D143: No | E143: Yes | F143: Crime | G143: Persephone, Lux | H143: 3 | N143: 4000 | V143: Cover Your Tracks
A144: F:tG | B144: Niska | C144: Postman only run once | D144: No | E144: Yes | F144: Crime | G144: Space Bazaar, Red Sun | H144: 3 | N144: 4000 | V144: Cover your tracks
A145: F:tG | B145: Niska | C145: The temple job | D145: No | E145: Yes | F145: Crime | G145: St. Alban's, Red Sun | H145: 3 | N145: 4000 | V145: Explosives, Transport
A146: F:tG | B146: Niska | C146: What's yours is mine… | D146: No | E146: No | F146: Crime | G146: Triumph, Heinlein | H146: 2 | N146: Spec | T146: 2 | U146: 2 | V146: Pay = 1 Contra per crew
A147: F:tG | B147: Patience | C147: Dung run! | D147: Yes | E147: No | F147: Shipping | G147: Newhope, Georgia | I147: 2 Cargo | J147: Harvest, Red Sun | L147: 2 Cargo | N147: 1500 | S147: 2
A148: F:tG | B148: Patience | C148: Dung run! | D148: Yes | E148: No | F148: Shipping | G148: Three Hills, Georgia | I148: 2 Cargo | J148: Harvest, Red Sun | L148: 2 Cargo | N148: 1500 | S148: 2
A149: F:tG | B149: Patience | C149: Guns for my gun-hands | D149: No | E149: No | F149: Smuggling | G149: Silverhold, Heinlein | H149: 1 | I149: 2 Contra | J149: Athens, Georgia | L149: 2 Contra | N149: 2400 | S149: 2
A150: F:tG | B150: Patience | C150: Guns for my gun-hands | D150: No | E150: No | F150: Smuggling | G150: Silverhold, Heinlein | H150: 1 | I150: 2 Contra | J150: Three Hills, Georgia | L150: 2 Contra | N150: 2600 | S150: 2
A151: F:tG | B151: Patience | C151: Feed for the herds | D151: Yes | E151: No | F151: Shipping | G151: Harvest, Red Sun | I151: 3 Cargo | J151: Athens, Georgia | L151: 3 Cargo | N151: 1600 | S151: 2 | U151: 1
A152: F:tG | B152: Patience | C152: Feed for the herds | D152: Yes | E152: No | F152: Shipping | G152: Harvest, Red Sun | I152: 3 Cargo | J152: Priam, Georgia | L152: 3 Cargo | N152: 1800 | S152: 2 | U152: 1
A153: F:tG | B153: Patience | C153: Feed for the herds | D153: Yes | E153: No | F153: Shipping | G153: Harvest, Red Sun | I153: 3 Cargo | J153: Regina, Georgia | L153: 3 Cargo | N153: 1600 | S153: 2 | U153: 1
A154: F:tG | B154: Patience | C154: Big Black cattle drive | D154: Yes | E154: No | F154: Shipping | G154: Kerry, Georgia | I154: 4 Cargo | J154: Bellerophon, White Sun | L154: 4 Cargo | N154: 1800 | P154: Companion | Q154: 500 | R154: $ | S154: 2
A155: F:tG | B155: Patience | C155: Big Black cattle drive | D155: Yes | E155: No | F155: Shipping | G155: Athens, Georgia | I155: 4 Cargo | J155: Sihnon, White Sun | L155: 4 Cargo | M155: 4 | N155: 1600 | P155: Companion | Q155: 500 | R155: $ | S155: 2
A156: F:tG | B156: Patience | C156: The beef must flow! | D156: No | E156: No | F156: Smuggling | G156: Ezra, Georgia | I156: 2 Contra | J156: Jubilee, Red Sun | K156: 1 | L156: 2 Contra | N156: 3000 | S156: 2
A157: F:tG | B157: Patience | C157: The beef must flow! | D157: No | E157: No | F157: Smuggling | G157: Ithaca, Georgia | I157: 2 Contra | J157: Londinium, White Sun | K157: 1 | L157: 2 Contra | N157: 2200 | P157: Companion | Q157: 500 | R157: $ | S157: 2
A158: F:tG | B158: Patience | C158: The beef must flow! | D158: No | E158: No | F158: Smuggling | G158: Aphrodite, Murphy | I158: 2 Contra | J158: Osiris, White Sun | K158: 1 | L158: 2 Contra | M158: 3 | N158: 2600 | P158: Companion | Q158: 500 | R158: $ | S158: 2
A159: F:tG | B159: Patience | C159: The beef must flow! | D159: No | E159: No | F159: Smuggling | G159: Athens, Georgia | I159: 2 Contra | J159: Silverhold, Heinlein | K159: 1 | L159: 2 Contra | M159: 7 | N159: 2400 | S159: 2
A160: F:tG | B160: Patience | C160: Ranch hand recruitment | D160: Yes | E160: No | F160: Transport | G160: Space Bazaar, Red Sun | I160: Pass, no limit | J160: Aphrodite, Murphy | L160: Pass, no limit | N160: 300/P | P160: Medic | Q160: 400 | R160: $ | U160: 1
A161: F:tG | B161: Patience | C161: Ranch hand recruitment | D161: Yes | E161: No | F161: Transport | G161: Space Bazaar, Red Sun | I161: Pass, no limit | J161: Ithaca, Georgia | L161: Pass, no limit | N161: 300/P | P161: Medic | Q161: 400 | R161: $ | U161: 1
A162: F:tG | B162: Patience | C162: Henpecked Badger | D162: No | E162: No | F162: Crime | G162: Persephone, Lux | H162: 2 | N162: 3000 | P162: Companion | Q162: 500 | R162: $ | V162: Cover Your Tracks
A163: F:tG | B163: Patience | C163: Swipe settler rations | D163: No | E163: Yes | F163: Crime | G163: Brisingamen, Himinbjorg | H163: 2 | N163: 2800 | P163: Grifter | Q163: 500 | R163: $ | S163: 2
A164: F:tG | B164: Patience | C164: Swipe settler rations | D164: No | E164: Yes | F164: Crime | G164: St. Alban's, Red Sun | H164: 2 | N164: 2800 | P164: Grifter | Q164: 500 | R164: $ | S164: 2
A165: F:tG | B165: Patience | C165: Cattle rustling | D165: No | E165: No | F165: Crime | G165: Anson's World, Red Sun | H165: 2 | N165: 2400 | P165: Soldier | Q165: 300 | R165: $ | S165: 2 | V165: Transport
A166: BA | B166: Patience | C166: Range war: Brisingamen | D166: No | E166: No | F166: Crime | G166: Brisingamen, Himinbjorg | H166: 3 | N166: 1000 | O166: 300/Fight | P166: Soldier | Q166: 300 | R166: $ | V166: Firearm, Transport
A167: F:tG | B167: Patience | C167: Bank holdup | D167: No | E167: No | F167: Crime | G167: Gonghe, White Sun | H167: 3 | N167: 2800 | P167: Soldier | Q167: 300 | R167: $ | S167: 2 | T167: 1
A168: BA | B168: Patience | C168: Range war: Jiangyin | D168: No | E168: No | F168: Crime | G168: Jiangyin, Red Sun | H168: 2 | N168: 1000 | O168: 300/Fight | P168: Soldier | Q168: 300 | R168: $ | V168: Firearm, Transport
A169: F:tG | B169: Patience | C169: Motherlode Mine Holdup | D169: No | E169: No | F169: Crime | G169: Motherlode, Red Sun | H169: 3 | N169: 3000 | P169: Soldier | Q169: 300 | R169: $ | S169: 2 | T169: 1
A170: BA | B170: Patience | C170: Range war: Three Hills | D170: No | E170: No | F170: Crime | G170: Three Hills, Georgia | H170: 2 | N170: 1000 | O170: 200/Fight | P170: Soldier | Q170: 300 | R170: $ | V170: Firearm, Transport
A171: F:tG | B171: Patience | C171: Cattle rustling | D171: No | E171: No | F171: Crime | G171: Three Hills, Georgia | H171: 2 | N171: 2000 | P171: Soldier | Q171: 300 | R171: $ | S171: 2 | V171: Transport
A172: F:tG | B172: Patience | C172: Rob the Alliance pay train | D172: No | E172: No | F172: Crime | G172: Valentine, White Sun | H172: 3 | N172: 3000 | P172: Soldier | Q172: 300 | R172: $ | S172: 2 | V172: Explosives
A173: F:tG | B173: Patience | C173: Good fences make good neighbors | D173: No | E173: No | F173: Crime | G173: Ezra, Georgia | H173: 2 | N173: 3000 | V173: Cover Your Tracks
A174: BA | B174: Patience | C174: Range war: Feedlot sabotage | D174: No | E174: No | F174: Crime | G174: Gonghe, White Sun | H174: 2 | N174: 1000 | O174: 400/Tech | V174: Explosives
A175: BA | B175: Patience | C175: Range war: Cannary sabotage | D175: No | E175: No | F175: Crime | G175: New Melbourne, Red Sun | H175: 2 | N175: 1000 | O175: 400/Tech | V175: Explosives
A176: F:tG | B176: Patience | C176: Good old fashined mail robbery | D176: No | E176: No | F176: Crime | G176: Space Bazaar, Red Sun | H176: 2 | N176: 3000 | V176: Cover Your Tracks

Sheet: Mr. Universe
A1: Contact | B1: Name | C1: Legal | D1: Count | E1: Misbehave | F1: Warrant if Botched | G1: Pay | H1: per Misbehave | I1: Skill Limit | J1: Crew Limit | K1: Test | L1: Special
A2: Mr. Universe | B2: With your Hands Tied | C2: No | D2: 2 | H2: 500 | I2: [Fight]
A3: Mr. Universe | B3: A Wee Bit Naughty | C3: Yes | D3: 2 | G3: 1000
A4: Mr. Universe | B4: Go in Light | C4: No | D4: 1 | G4: 1000 | J4: 4
A5: Mr. Universe | B5: Someone is Talking | C5: No | D5: 2 | H5: 500 | I5: [Negotiate]
A6: Mr. Universe | B6: Do it off the Grid | C6: No | D6: 2 | H6: 500 | I6: [Tech]
A7: Mr. Universe | B7: Right in my Orbit | C7: Yes | D7: 2 | E7: 2 | G7: 1500
A8: Mr. Universe | B8: Run the long Con | C8: Yes | D8: 1 | F8: x | G8: 4 Cargo | K8: Bribes 8+
A9: Mr. Universe | B9: How Weird is That? | C9: No | D9: 1 | G9: 1 Gear | L9: No Gear
A10: Mr. Universe | B10: Up the Body Count | C10: Yes | D10: 1 | F10: x | G10: 1000 | K10: [Fight] 10+
A11: Mr. Universe | B11: To the Eyes & Ears of the 'Verse | C11: Yes | D11: 1 | G11: 2 Contra | K11: [Bribes] 8+
A12: Mr. Universe | B12: Techno Kung-Fu | C12: Yes | D12: 1 | F12: x | G12: 4 Cargo | K12: [Tech] 8+
A13: Mr. Universe | B13: Grand Theft Larceny | C13: No | D13: 1 | E13: 2 | H13: Contra
A14: Mr. Universe | B14: Two more than I Need | C14: No | D14: 2 | G14: 1500 | J14: 3
A15: Mr. Universe | B15: Play Merry Hob | C15: No | D15: 1 | E15: 2 | H15: 500
A16: Mr. Universe | B16: Bruises & Contusions | C16: Yes | D16: 1 | G16: 1000 | K16: [Fight] 7+ | L16: Kosherized
A17: Mr. Universe | B17: Action on the Side | C17: No | D17: 1 | E17: 2 | H17: Cargo
A18: Mr. Universe | B18: The Puppet Theater | C18: Yes | D18: 1 | G18: 2 Contra | K18: [Tech] 8+
A19: Mr. Universe | B19: The Very Best Violence | C19: Yes | D19: 1 | E19: 3 | G19: 2000
A20: Mr. Universe | B20: Two by Two | C20: No | D20: 1 | G20: 2000 | J20: 2

Sheet: Piracy
A1: Source | B1: Contact | C1: Name | D1: Legal | E1: Immoral | F1: Type | G1: Location | H1: Success | I1: Botch | J1: Pay | K1: Per | L1: Special
A2: PBH | B2: Amnon Duul | C2: Contract jumper | D2: No | E2: Sub | F2: Piracy | G2: Any Rival | H2: 3 Inactive Jobs | I2: Warrant | J2: 800 | K2: Job | L2: Boarding Test 6
A3: PBH | B3: Amnon Duul | C3: Contract jumper | D3: No | E3: Sub | F3: Piracy | G3: Any Rival | H3: 3 Inactive Jobs | I3: Warrant | J3: 800 | K3: Job | L3: Boarding Test 6
A4: PBH | B4: Amnon Duul | C4: Contract jumper | D4: No | E4: Sub | F4: Piracy | G4: Any Rival | H4: 3 Inactive Jobs | I4: Warrant | J4: 800 | K4: Job | L4: Boarding Test 6
A5: PBH | B5: Amnon Duul | C5: Contract jumper | D5: No | E5: Sub | F5: Piracy | G5: Any Rival | H5: 3 Inactive Jobs | I5: Warrant | J5: 800 | K5: Job | L5: Boarding Test 6
A6: PBH | B6: Amnon Duul | C6: Contract jumper | D6: No | E6: Sub | F6: Piracy | G6: Any Rival | H6: 3 Inactive Jobs | I6: Warrant | J6: 800 | K6: Job | L6: Boarding Test 6
A7: PBH | B7: Badger | C7: Pilfer, purlion and plunder | D7: No | E7: Sub | F7: Piracy | G7: Any Rival | H7: 6 Goods | I7: Kill 1, Warrant | J7: 200 | K7: Good | L7: Boarding Test 6
A8: PBH | B8: Badger | C8: Pilfer, purlion and plunder | D8: No | E8: Sub | F8: Piracy | G8: Any Rival | H8: 6 Goods | I8: Kill 1, Warrant | J8: 200 | K8: Good | L8: Boarding Test 6
A9: PBH | B9: Badger | C9: Pilfer, purlion and plunder | D9: No | E9: Sub | F9: Piracy | G9: Any Rival | H9: 6 Goods | I9: Kill 1, Warrant | J9: 200 | K9: Good | L9: Boarding Test 6
A10: PBH | B10: Badger | C10: Pilfer, purlion and plunder | D10: No | E10: Sub | F10: Piracy | G10: Any Rival | H10: 6 Goods | I10: Kill 1, Warrant | J10: 200 | K10: Good | L10: Boarding Test 6
A11: PBH | B11: Badger | C11: Pilfer, purlion and plunder | D11: No | E11: Sub | F11: Piracy | G11: Any Rival | H11: 6 Goods | I11: Kill 1, Warrant | J11: 200 | K11: Good | L11: Boarding Test 6
A12: PBH | B12: Niska | C12: A message from Niska | D12: No | E12: Sub | F12: Piracy | G12: Rival not Solid with Niska | H12: All Goods | I12: Kill 1, Warrant | J12: 200 | K12: Good | L12: Boarding Test 6
A13: PBH | B13: Niska | C13: A message from Niska | D13: No | E13: Sub | F13: Piracy | G13: Rival not Solid with Niska | H13: All Goods | I13: Kill 1, Warrant | J13: 200 | K13: Good | L13: Boarding Test 6
A14: PBH | B14: Niska | C14: A message from Niska | D14: No | E14: Sub | F14: Piracy | G14: Rival not Solid with Niska | H14: All Goods | I14: Kill 1, Warrant | J14: 200 | K14: Good | L14: Boarding Test 6
A15: PBH | B15: Niska | C15: A message from Niska | D15: No | E15: Sub | F15: Piracy | G15: Rival not Solid with Niska | H15: All Goods | I15: Kill 1, Warrant | J15: 200 | K15: Good | L15: Boarding Test 6
A16: PBH | B16: Niska | C16: A message from Niska | D16: No | E16: Sub | F16: Piracy | G16: Rival not Solid with Niska | H16: All Goods | I16: Kill 1, Warrant | J16: 200 | K16: Good | L16: Boarding Test 6
A17: PBH | B17: Harken | C17: Alliance commission | D17: Yes | E17: Sub | F17: Piracy | G17: Rival Outlaw Ship | H17: 4 Goods | I17: Kill 1 | J17: 200 | K17: Good | L17: Boarding Test 6
A18: PBH | B18: Harken | C18: Alliance commission | D18: Yes | E18: Sub | F18: Piracy | G18: Rival Outlaw Ship | H18: 4 Goods | I18: Kill 1 | J18: 200 | K18: Good | L18: Boarding Test 6
A19: PBH | B19: Harken | C19: Alliance commission | D19: Yes | E19: Sub | F19: Piracy | G19: Rival Outlaw Ship | H19: 4 Goods | I19: Kill 1 | J19: 200 | K19: Good | L19: Boarding Test 6
A20: PBH | B20: Harken | C20: Alliance commission | D20: Yes | E20: Sub | F20: Piracy | G20: Rival Outlaw Ship | H20: 4 Goods | I20: Kill 1 | J20: 200 | K20: Good | L20: Boarding Test 6
A21: PBH | B21: Harken | C21: Alliance commission | D21: Yes | E21: Sub | F21: Piracy | G21: Rival Outlaw Ship | H21: 4 Goods | I21: Kill 1 | J21: 200 | K21: Good | L21: Boarding Test 6
A22: PBH | B22: Patience | C22: Herd rustlin' | D22: No | E22: Sub | F22: Piracy | G22: Rival With no Active Patience Jobs | H22: 5 Goods | I22: Kill 1, Warrant | J22: 200 | K22: Good | L22: Boarding Test 6
A23: PBH | B23: Patience | C23: Herd rustlin' | D23: No | E23: Sub | F23: Piracy | G23: Rival With no Active Patience Jobs | H23: 5 Goods | I23: Kill 1, Warrant | J23: 200 | K23: Good | L23: Boarding Test 6
A24: PBH | B24: Patience | C24: Herd rustlin' | D24: No | E24: Sub | F24: Piracy | G24: Rival With no Active Patience Jobs | H24: 5 Goods | I24: Kill 1, Warrant | J24: 200 | K24: Good | L24: Boarding Test 6
A25: PBH | B25: Patience | C25: Herd rustlin' | D25: No | E25: Sub | F25: Piracy | G25: Rival With no Active Patience Jobs | H25: 5 Goods | I25: Kill 1, Warrant | J25: 200 | K25: Good | L25: Boarding Test 6
A26: PBH | B26: Patience | C26: Herd rustlin' | D26: No | E26: Sub | F26: Piracy | G26: Rival With no Active Patience Jobs | H26: 5 Goods | I26: Kill 1, Warrant | J26: 200 | K26: Good | L26: Boarding Test 6

Sheet: Bounties
A1: Source | B1: Contact | C1: Name | D1: Legal | E1: Immoral | F1: Type | G1: Location 1 | H1: Success | I1: Botch | J1: Location 2 | K1: Pay
A2: PBH | B2: Bounty | C2: Wanted: The Fixer | D2: Yes | E2: No | F2: Bounty | G2: Persephone, Lux | H2: Apprehend | I2: Kill 1 | J2: Ariel, White Sun | K2: 3000
A3: PBH | B3: Bounty | C3: Wanted: Grange Brothers | D3: Yes | E3: No | F3: Bounty | G3: Regina, Georgia | H3: Apprehend | I3: Kill 2 | J3: Athens, Georgia | K3: 3000
A4: PBH | B4: Bounty | C4: Wanted: Simon Tam | D4: Yes | E4: Yes | F4: Bounty | G4: Persephone, Lux | H4: Apprehend | J4: Command Cruiser | K4: 2600
A5: PBH | B5: Bounty | C5: Wanted: River Tam | D5: Yes | E5: Yes | F5: Bounty | G5: Persephone, Lux | H5: Apprehend | I5: Kill 2 | J5: Command Cruiser | K5: 4000
A6: PBH | B6: Bounty | C6: Wanted: The Specialist | D6: Yes | E6: No | F6: Bounty | G6: Regina, Georgia | H6: Apprehend | I6: Kill 2 | J6: Command Cruiser | K6: 3200
A7: PBH | B7: Bounty | C7: Wanted: Dalin | D7: Yes | E7: No | F7: Bounty | G7: Space Bazaar, Red Sun | H7: Apprehend | I7: Kill 1 | J7: Command Cruiser | K7: 2600
A8: PBH | B8: Bounty | C8: Wanted: Stitch | D8: Yes | E8: No | F8: Bounty | G8: Silverhold, Heinlein | H8: Apprehend | I8: Kill 2 | J8: Harvest, Red Sun | K8: 3200
A9: PBH | B9: Bounty | C9: Wanted: Jayne | D9: Yes | E9: No | F9: Bounty | G9: Silverhold, Heinlein | H9: Apprehend | I9: Kill 2 | J9: Harvest, Red Sun | K9: 3600
A10: PBH | B10: Bounty | C10: Wanted: Interrogator | D10: Yes | E10: No | F10: Bounty | G10: Osiris, White Sun | H10: Apprehend | I10: Kill 1 | J10: Londinium, White Sun | K10: 2600
A11: PBH | B11: Bounty | C11: Wanted: Bree | D11: Yes | E11: No | F11: Bounty | G11: Persephone, Lux | H11: Apprehend | I11: Kill 1 | J11: Londinium, White Sun | K11: 2600
A12: PBH | B12: Bounty | C12: Wanted: Crow | D12: Yes | E12: no | F12: Bounty | G12: Regina, Georgia | H12: Apprehend | I12: Kill 2 | J12: Londinium, White Sun | K12: 3500
A13: PBH | B13: Bounty | C13: Wanted: Zoe | D13: Yes | E13: Yes | F13: Bounty | G13: Silverhold, Heinlein | H13: Apprehend | I13: Kill 2 | J13: Londinium, White Sun | K13: 3600
A14: PBH | B14: Bounty | C14: Wanted: Jesse | D14: Yes | E14: No | F14: Bounty | G14: Space Bazaar, Red Sun | H14: Apprehend | I14: Kill 1 | J14: Londinium, White Sun | K14: 2600
A15: PBH | B15: Bounty | C15: Cortex Alert: Enforcers | D15: Yes | E15: No | F15: Bounty | H15: Apprehend | I15: Kill 1 | J15: Londinium, White Sun | K15: 2000
A16: PBH | B16: Bounty | C16: Wanted: Helen | D16: Yes | E16: Yes | F16: Bounty | G16: Space Bazaar, Red Sun | H16: Apprehend | I16: Kill 1 | J16: Newhope, Georgia | K16: 2600
A17: PBH | B17: Bounty | C17: Wanted: Billy | D17: Yes | E17: No | F17: Bounty | G17: Persephone, Lux | H17: Apprehend | I17: Kill 1 | J17: Osiris, White Sun | K17: 2500
A18: PBH | B18: Bounty | C18: Cortex Alert: Scrappers | D18: Yes | E18: No | F18: Bounty | H18: Apprehend | I18: Kill 1 | J18: Osiris, White Sun | K18: 2000
A19: PBH | B19: Bounty | C19: Wanted: Two-Fry | D19: Yes | E19: No | F19: Bounty | G19: Regina, Georgia | H19: Apprehend | I19: Kill 1 | J19: Persephone, Lux | K19: 2600
A20: PBH | B20: Bounty | C20: Wanted: Tracey | D20: Yes | E20: Yes | F20: Bounty | G20: Space Bazaar, Red Sun | H20: Apprehend | I20: Kill 1 | J20: Sihnon, White Sun | K20: 2600
A21: PBH | B21: Bounty | C21: Cortex Alert: Bandits | D21: Yes | E21: No | F21: Bounty | H21: Apprehend | I21: Kill 1 | J21: Triumph, Heinlein | K21: 2000

Sheet: Misbehave
A1: Name | B1: Suit | C1: Ace | D1: Option 1 | E1: Details | F1: Option 2 | G1: Details | I1: Fight | J1: Tech | K1: Talk | L1: Keyword | M1: Other
A2: A Formal Affair | B2: Clubs | C2: Companion | D2: Look'n the Part | E2: Requires FANCY DUDS. Proceed. | F2: Work the Crowd | G2: Negotiatate 6; 1-5 Attempt Botched. 6+ Proceed. | K2: 5 | L2: Fancy Duds
A3: A Vote of No Confidence | B3: Clubs | D3: I Love My Captain | E3: Requires no Disgruntled Crew: Load 1 Cargo. Proceed. | F3: We'll be Takin' Out Cuts Now! | G3: Pay each Disgruntled Crew an extra Cut now or discard them. Proceed. | M3: No Disgruntled
A4: Alliance Operatives | B4: Clubs | C4: River Tam | D4: Two by Two, Hands of Blue | E4: Requires TRANSPORT. Attempt Botched. RESHUFFLE DECK | F4: Trouble You've Not Known… | G4: Fight 10; 1-5 Kill all Crew; Warrant Issued. 6-9 Kill 2 Crew, Warrant Issued. 10+ Attempt Botched. RESHUFFLE DECK | I4: 9 | L4: Transport
A5: Ambush | B5: Clubs | C5: Sniper Rifle | D5: They've Got Us Surrounded | E5: 8+ Fight; 1-7 Kill a Crew, Warrant Issued. 8+ Attempt Botched. | F5: We've Got Ya Outnumbered! | G5: Requires 5 or more Crew on Job: Proceed. | I5: 7 | M5: Crew of 5
A6: An Interesting Day | B6: Clubs | D6: Money Weren't Good Enough | E6: Negotiate 12 Bribes; 1-11 Discard All Mercs. Attempt Botched. 12+ Proceed. | F6: Curse Your Sudden But Inveitable Betrayal! | G6: If Mercs' Fight total is higher than the rest of the Crew's, discard all Mercs. Include Gear in Fight totals. Proceed. | K6: 11 | M6: Bribes
A7: Everthing That's Not Nailed Down | B7: Clubs | D7: Load 'er Up! | E7: Requires TRANSPORT. Load up to 3 Contraband. Proceed. | F7: Idle Hands are the Devil's Workshop | G7: Fore each Crew on Job without Gear, Load 1 Contraband. Proceed. | M7: Pass
A8: Everthing That's Not Nailed Down | B8: Clubs | D8: Load 'er Up! | E8: Requires TRANSPORT. Load up to 3 Contraband. Proceed. | F8: Idle Hands are the Devil's Workshop | G8: Fore each Crew on Job without Gear, Load 1 Contraband. Proceed. | M8: Pass
A9: It Takes a Woman's Touch | B9: Clubs | C9: Companion | D9: Poise and Grace | E9: Negotiate 7 +3 Negotiate with FANCY DUDS; 1-6 Attempt Botched. 7+ Proceed. | F9: Subtlety and Subterfuge | G9: Tech 7 +3 Tech with HACKING RIG; 1-6 Attempt Botched. 7+ Proceed. | J9: 6 | K9: 6
A10: Knife Fight | B10: Clubs | C10: Crow | D10: Brought a Gun, Eh? | E10: Requires FIREARM. Proceed. | F10: Slice & Dice | G10: Fight 8 +3 Fight with any Knife. 1-7 Attempt Botched. 8+ Proceed. | I10: 7 | L10: Firearm
A11: Locals in Need | B11: Clubs | D11: Feed Some Mouths | E11: Discard 1 Cargo. Remove Disgruntled from all Moral Crew. Proceed. | F11: We Don't Have Time for This | G11: Fight 3; 1-2 Attempt Botched. 3+ Disgruntle all Moral Crew. Proceed. | I11: 2 | M11: 1 Cargo | N11: Fight = Disgruntle Moral
A12: Old Vendetta | B12: Clubs | D12: One on One | E12: Fight 6 Choose 1 Crew for Fight; 1-5 Kill Chosen Crew. Attempt Botched. 6+ Proceed. | F12: Run Like Cowardly Pisspots | G12: Requires TRANSPORT. Disgruntle all Crew. Proceed. | I12: 5 | L12: Transport | N12: Fight = 1 Crew. Transport = Disgruntle All
A13: A Bit of Local Color | B13: Diamond | C13: Wash | D13: Bar Fight! | E13: Fight 6 Kosherized Rules; 1-5 Disgruntle all Crew on Job. Attempt Botched. 6+ Proceed. | F13: We Will Blow a New Crater in This Little Moon… | G13: Negotiate 6; 1-5 Attempt Botched. 6+ Proceed. | I13: 5 | K13: 5 | N13: Fight = Kosherized
A14: A Bit of Local Color | B14: Diamond | C14: Wash | D14: Bar Fight! | E14: Fight 6 Kosherized Rules; 1-5 Disgruntle all Crew on Job. Attempt Botched. 6+ Proceed. | F14: We Will Blow a New Crater in This Little Moon… | G14: Negotiate 6; 1-5 Attempt Botched. 6+ Proceed. | I14: 5 | K14: 5 | N14: Fight = Kosherized
A15: A Rival Crew | B15: Diamond | D15: Getting Awfully Crowded in My Sky… | E15: Fight 9; 1-8 Kill a Crew, Warrant Issued. 9+ Proceed. | F15: Maybe We Can Make a Deal. | G15: Proceed. If this Job attempt is successful, cut Pay in half, rounded down. Bonuses are unaffected. | I15: 8 | M15: Pass | N15: Cut pay on Pass
A16: Gun Play | B16: Diamond | D16: My Guns Will Do the Talkin' | E16: Fight 7; 1-6 Kill a Crew, Attempt Botched. 7+ Proceed. | F16: Crawl Away Like a Bitty Little Bug | G16: Disgruntle all Crew. Attempt Botched. | I16: 6 | M16: Pass | N16: Pass = Disgruntle all
A17: Gun Play | B17: Diamond | D17: My Guns Will Do the Talkin' | E17: Fight 7; 1-6 Kill a Crew, Attempt Botched. 7+ Proceed. | F17: Crawl Away Like a Bitty Little Bug | G17: Disgruntle all Crew. Attempt Botched. | I17: 6 | M17: Pass | N17: Pass = Disgruntle all
A18: Keep a Low Profile | B18: Diamond | C18: Sniper Rifle | D18: Take the Guards Out… Quiet Like | E18: Fight 6 Kosherized Rules; 1-5 Kill a Crew, Attempt Botched. 6+ Proceed. | F18: Let's See Ya Talk Your Walk Out of This One | G18: Negotiate 9 Bribes; 1-8 Warrant Issued. 9+ Proceed. | I18: 5 | K18: 8 | M18: Bribes | N18: Fight = Kosherized
A19: Keep a Low Profile | B19: Diamond | C19: Sniper Rifle | D19: Take the Guards Out… Quiet Like | E19: Fight 6 Kosherized Rules; 1-5 Kill a Crew, Attempt Botched. 6+ Proceed. | F19: Let's See Ya Talk Your Walk Out of This One | G19: Negotiate 9 Bribes; 1-8 Warrant Issued. 9+ Proceed. | I19: 5 | K19: 8 | M19: Bribes | N19: Fight = Kosherized
A20: Old-Fashioned Shoot Out | B20: Diamond | D20: Let the Bullets Fly | E20: Fight 8; 1-7 Kill a Crew, Attempt Botched. 8+ Proceed. | F20: Can't Get Paid If Yer Dead | G20: Requires Transport. Proceed. | I20: 7 | L20: Transport
A21: Time for Some Thrillin' Heroics | B21: Diamond | D21: Savin' the Day | E21: Fight 7; 1-6 Kill a Crew, Warrant Issued. 7+ Remove Disgruntled from Moral Crew, Proceed. | F21: Hump 'Em | G21: Disgruntle all Moral Crew. Proceed. | I21: 6 | M21: Pass | N21: Pass = Disgruntled Moral
A22: Alliance Patrol | B22: Hearts | C22: Fake ID | D22: Identification Please | E22: Negotiate 8 - 1 for each of your Warrants. 1-7 Warrant Issued. 8+ Proceed. | F22: Hightail It Outta There! | G22: Requires Transport. Attempt Botched. | K22: 7 | L22: Transport
A23: Alliance Patrol | B23: Hearts | C23: Fake ID | D23: Identification Please | E23: Negotiate 8 - 1 for each of your Warrants. 1-7 Warrant Issued. 8+ Proceed. | F23: Hightail It Outta There! | G23: Requires Transport. Attempt Botched. | K23: 7 | L23: Transport
A24: Alliance Patrol | B24: Hearts | C24: Fake ID | D24: Identification Please | E24: Negotiate 8 - 1 for each of your Warrants. 1-7 Warrant Issued. 8+ Proceed. | F24: Hightail It Outta There! | G24: Requires Transport. Attempt Botched. | K24: 7 | L24: Transport
A25: Backwater Deputies | B25: Hearts | D25: Maybe We Can Work Something Out? | E25: Negotiate 9 Bribes; 1-8 Attempt Botched. 9+ Proceed. | F25: There's Only a Couple of 'Em! | G25: Fight 7; 1-6 Kill a Crew, Warrant Issued. 7+ Proceed. | I25: 6 | K25: 8 | M25: Bribes
A26: Denied Docking Rights | B26: Hearts | C26: Fake ID | D26: Cost of Doing Business | E26: Negotiate 9 Bribes; 1-8 Attempt Botched. 9+ Proceed. | F26: These Are Not the Crooks You're Looking For… | G26: Tech 6; 1-5 Warrant Issued. 6+ Proceed. | J26: 5 | K26: 8 | M26: Bribes
A27: Kidnapped By Hill Folk | B27: Hearts | C27: Hill Folk | D27: The Witch Must Burn! | E27: Negotiate 8; 1-7 Kill a Crew, Attempt Botched. 8+ Proceed. | F27: Note the Man with the Really Big Gun | G27: Requires at least 2 Fight from FIREARM Gear: Proceed. | K27: 7 | M27: Firearm 2
A28: Let's Go to the Crappy Town Where I'm a Hero! | B28: Hearts | C28: Jayne's Hat | D28: Speech! Speech! Speech! | E28: Negotiate 6; 1-5 Disgruntled all Crew. Attempt Botched. 6+ Proceed. | F28: Diabolical Master of Disguise | G28: Tech 6; 1-5 Warrant Issued. 6+ Proceed. | J28: 5 | K28: 5
A29: The Local Law | B29: Hearts | D29: Money Talks! | E29: Negotiate 11 Bribes; 1-10 Attempt Botched. 11+ Proceed. | F29: Guns A'Blazin'! | G29: Fight 8; 1-7 Kill a Crew, Warrant Issued. 8+ Proceed. | I29: 7 | K29: 10 | M29: Bribes
A30: The Local Law | B30: Hearts | D30: Money Talks! | E30: Negotiate 11 Bribes; 1-10 Attempt Botched. 11+ Proceed. | F30: Guns A'Blazin'! | G30: Fight 8; 1-7 Kill a Crew, Warrant Issued. 8+ Proceed. | I30: 7 | K30: 10 | M30: Bribes
A31: The Sheriff's Justice | B31: Hearts | C31: Companion | D31: A Hard Man to Sway | E31: Negotiate 8; 1-7 Warrant Issued. 8+ Attempt Botched. | F31: An' Hell Followed With Him… | G31: Fight 9; 1-4 Kill all Crew, Warrant Issued. 5-8 Kill 2 Crew, Warrant Issued. 9+ Kill 1 Crew, Proceed. | I31: 8 | K31: 7 | N31: Fight = Kill 1 Crew
A32: A Little Job on the Side | B32: Spades | D32: Profitable Detour | E32: Tech 7; 1-6 Attempt Botched. 7+ Take 1500. Proceed. | F32: Stay on Target… | G32: Proceed. | J32: 6 | M32: Pass
A33: An Unexpected Opportunity | B33: Spades | D33: Deal of the Century | E33: Negotiate 7; 1-6 Attempt Botched. 7+ Buy up to 3 Contraband for $100 each. Attempt Botched. | F33: Walk Away Entirely | G33: Proceed. | K33: 6 | M33: Pass
A34: It Was the Best Day Ever! | B34: Spades | C34: Simon Tam | D34: I Was Pompous… | E34: If you have FANCY DUDS, Proceed. Otherwise, Negotiate 6; 1-5 Attempt Botched. 6+ Proceed. | F34: My Sister Was Crazy… | G34: If you have Medic, Proceed. Otherwise, Tech 6; 1-5 Attempt Botched. 6+ Proceed. | J34: 5 | K34: 5 | M34: Fancy Duds. Medic
A35: Kill the Alarm | B35: Spades | C35: Hacking Rig | D35: Rig a Bypass | E35: Tech 5; 1-4 Attempt Botched. 6+ Proceed. | F35: Just Shoot the Gorram Thing! | G35: Fight 7; 1-6 Warrant Issued. 7+ Proceed. | I35: 6 | J35: 4
A36: Kill the Alarm | B36: Spades | C36: Hacking Rig | D36: Rig a Bypass | E36: Tech 5; 1-4 Attempt Botched. 6+ Proceed. | F36: Just Shoot the Gorram Thing! | G36: Fight 7; 1-6 Warrant Issued. 7+ Proceed. | I36: 6 | J36: 4
A37: Reaver Raid | B37: Spades | C37: River Tam | D37: Run for Your Gorram Life! | E37: Requires TRANSPORT. Kill a Crew, Attempt Botched. | F37: Hide in the Vault | G37: Tech 5; 1-4 Kill all Crew, Attempt Botched. 5+ Take $1000, Attempt Botched. | J37: 4 | L37: Transport | N37: Transport = Kill
A38: State of the Art Security System | B38: Spades | C38: Alliance Ident Card | D38: Work Some Hacking Magic | E38: Tech 9 +3 Tech with HACKING RIG; 1-8 Warrant Issued. 9+ Proceed. | F38: Bao Xin Jiu Huo | G38: Requires EXPLOSIVES. Attempt Botched. | J38: 8 | M38: Explosives | N38: Tech = +3 with Hacking Rig
A39: Tight Security | B39: Spades | C39: Hacking Rig | D39: See What You Can Do… | E39: Tech 7; 1-6 Attempt Botched. 7+ Proceed. | F39: Oh, Real Subtle Guys… | G39: Fight 9; 1-8 Kill a Crew, Warrant Issued. 9+ Proceed. | I39: 8 | J39: 6
A40: Tight Security | B40: Spades | C40: Hacking Rig | D40: See What You Can Do… | E40: Tech 7; 1-6 Attempt Botched. 7+ Proceed. | F40: Oh, Real Subtle Guys… | G40: Fight 9; 1-8 Kill a Crew, Warrant Issued. 9+ Proceed. | I40: 8 | J40: 6
A41: We Need a Distraction! | B41: Spades | C41: Companion | D41: Big Gorram Blast | E41: Requires EXPLOSIVES. Proceed. | F41: Jigger a Surprise for 'Em | G41: Tech 7; 1-6 Warrant Issued. 7+ Proceed. | J41: 6 | M41: Explosives

Sheet: Nav Cards
A1: Name | B1: Alliance | C1: Border | D1: Border - BS | E1: Rim | F1: Option 1 | G1: Details 1 | H1: Option 2 | I1: Details 2 | J1: Reshuffle
A2: "Family" Dinner | B2: 1 | C2: 1 | D2: 1 | F2: Kind of You to Share | G2: --Spend 1 Cargo. --Remove Disgruntled from all Crew. --Keep Flying. | H2: I'll be in my Bunk | I2: --Keep Flying.
A3: A Rogue Trader | C3: 1 | D3: 1 | F3: Deals on the Go! | G3: --You may buy Fuel for $200, Parts for $300 or up to 3 Contraband for $400 each. --Keep Flying. | H3: Piracy! | I3: Moral Crew become Disgruntled. Fight 6. 1-5 Kill a Crew. Full Stop. 6+ Load 3 Contraband. Full Stop.
A4: Abandoned Ship | B4: 1 | F4: "Rescue" the Valuables | G4: --SALVAGE OP: Load 2 Contraband. --Full Stop. | H4: Slide on By | I4: --Keep Flying.
A5: Abandoned Tanker | E5: 1 | F5: Smells like Reavers | G5: Keep Flying! | H5: Fill 'er Up! | I5: Requires Mechanic: Salvage Op: Load Fuel, no limit. Full Stop.
A6: Alliance Cruiser | B6: 1 | F6: Can't Run. They're Pullin' Us In! | G6: -- Move Cruiser to your Sector. -- Pay Fines: $1000 per Warrant. -- Clear Warrants. -- ALL Contraband & Fugitives seized, including those in your Stash. -- Roll for each Wanted Crew 1: Remove Crew from Game. 2-6: Crew Dodges Capture. -- Full Stop | J6: Y
A7: Alliance Entanglements | B7: 1 | F7: Wild Gosling Chase | G7: --Move the Alliance Cruiser to any Allaince Sector not occupied by a Firefly. --Keep Flying. | H7: A Legitimate Tip | I7: Requires Solid Harken Rep: --Move the Cruiser to an Alliance Sector with an Outlaw Ship. --Take $500 & Keep Flying.
A8: Cruiser Patrol | B8: 4 | G8: --Player to your right must move Alliance Cruiser 1 Sector within Alliance Space. --Keep Flying.
A9: Customs Inspection | B9: 2 | F9: Prepare to be Boarded! | G9: --Contraband & Fugitives not in your Stash are seized. --Full Stop. | H9: Turn and Burn! | I9: --Spend 1 Fuel. --Warrant Issued. --Evade.
A10: Derelict Ship | C10: 2 | D10: 2 | F10: Pick the Bones | G10: --Salvage Op: Load 2 Cargo. --Full Stop. | H10: Hold to Course | I10: --Keep Flying.
A11: Distress Signal | B11: 1 | F11: We a Search & Rescue Tug? | G11: --Spend 1 Fuel. --Remove Disgruntled from all Moral Crew and take $200. --Full Stop. | H11: Say a Prayer & Slide on By | I11: --All Moral Crew are Disgruntled. --Keep Flying.
A12: Freighter Convoy | B12: 1 | F12: Shewd Bartering | G12: --You may purchase Fuel for $200, Parts for $300 and up to 3 Cargo for $300 each. --Keep Flying. | H12: Goin' Pirate! | I12: --Moral Crew become Disgruntled. Fight 8; 1-7 Kill a Crew. Full Stop. 8+ Load 3 Contraband. Full Stop.
A13: Fuel Coupling Failure | E13: 1 | F13: Everything's Shiny Cap'n | G13: Breakdown: Spend 1 Part. Keep Flying | H13: She's Hemorrhaging Fuel!! | I13: Keep Flying. -1 Fuel for each sector this turn.
A14: Ghost Ship | C14: 1 | D14: 1 | F14: I Got a Bad Feelin' | G14: --Keep Flying. | H14: Reaver on Board! | I14: Fight 7 Salvage Op; 1-6 Kill 2 Crew. Full Stop. 7+ Take $1000. Full Stop.
A15: Grav-Well Maneuver | E15: 1 | F15: Slingshot Roundouse | G15: Requires Pilot. If in planetary Sector, =3 to Ship's Range this turn. Keep Flying | H15: Steady at the Helm | I15: Keep Flying.
A16: If'n the Coil Busts, We're Driftin' | B16: 1 | F16: Best not Bust Then! | G16: Tech 8 Breakdown 1-7 Full Stop. 8+ Keep Flying. | H16: Replace the Whole Damn Mess | I16: --Spend 2 Parts. --Keep Flying.
A17: Locking Horns over Scraps | E17: 1 | F17: Finagle the Lion's Share | G17: Negociate 6; 1-5 Load 1 Goods. 6+ Salvage Op: Load 3 Goods. Full Stop | H17: Winner Takes All | I17: Fight 10; 1-9 Load no Goods. 10+ Salvage Op: Load 4 Goods. Full Stop.
A18: Minor Technical Difficulty | B18: 1 | F18: Just Keep Her in the Air | G18: Tech 5 Breakdown; 1-4 Full Stop. 5+ Keep Flying. | H18: Swap in the Spare | I18: --Spend 1 Part. --Keep Flying.
A19: Nav Hazard: Asteroid | C19: 1 | D19: 1 | F19: A Leave on the Wind… | G19: --If you have Pilot, Keep Flying. --Otherwise: Spend 1 Fuel, Keep Flying. | H19: Take the Long Way 'Round | I19: --Full Stop.
A20: Nav Hazard: Debris Field | C20: 1 | D20: 1 | F20: Push on Through | G20: --If you have Pilot, Keep Flying. --Otherwise: Spend 1 Fuel, Keep Flying. | H20: Stop and Take a Look | I20: Tech 6 Salvage Op 1-3 Full Stop. 4-5 Load 1 Cargo, Full Stop. 6+ Load 2 Cargo, Full Stop.
A21: Punctured Fuel Lines | C21: 1 | D21: 1 | F21: Patch It Best Ya Can | G21: Tech 5 Breakdown; 1-4 Lose 2 Fuel. Full Stop. 5+ Keep Flying. | H21: Replace the Whole Damn Mess | I21: --Spend 1 Part. --Keep Flying.
A22: Reaver Bait | C22: 1 | D22: 1 | F22: Decoy 'Em | G22: --Move the Reaver Cutter to any Border Sector not occupied by a Firefly. Keep Flying. | H22: They Won't See This Comin' | I22: --Move Reaver Cutter to your location. --Evade.
A23: Reaver Cutter | C23: 1 | D23: 1 | E23: 1 | F23: If We're Very Lucky… | G23: Move ship. Kill all Passengers & Fugitives. Fight 8; 1-7 Kill 2 Crew, Evade. 8+ Kill 1 Crew Evade. | H23: Crazy Ivan! | I23: Requires Pilot and Mechanic: --Spend 1 Fuel. --Evade. | J23: Y
A24: Reavers in Orbit | E24: 3 | G24: --The player to your right must move a Reaver Ship to a Planetary Sector no occupied by a Firefly, in Border or Rim Space. --Keep Flying
A25: Reavers on the Hunt | C25: 8 | D25: 5 | E25: 6 | G25: --Player to your right must move Reaver Cutter 1 Sector within Border [or Rim] Space. Keep Flying.
A26: Ruttin' Drive Core's Blown | C26: 1 | D26: 1 | F26: See What's Ailin' Her | G26: Tech 8 Breakdown; 1-7 Full Stop. 8+ Keep Flying. | H26: Tell Me We Got a Spare… | I26: --Spend 2 Parts. --Keep Flying.
A27: Scrapper Ambush | C27: 1 | D27: 1 | F27: Slip the Net | G27: Tech 5; 1-4 Discard 1 Ship Upgrade. 5+ Keep Flying. | H27: Take 'em Head On! | I27: Fight 9 Salvage Op; 1-8 Kill a Crew. Full Stop. 9+ Take $500 and 2 Parts. Full Stop.
A28: Ship Graveyard | C28: 1 | D28: 1 | F28: Premium Salvage | G28: Tech 8 Salvage Op; 1-7 Load 2 Parts. Full Stop. 8+ Take 1 Ship Upgrade from any discard pile. Full Stop. | H28: No Time to Dilly Dally | I28: --Keep Flying.
A29: The Big Black | B29: 25 | C29: 18 | D29: 18 | E29: 10 | I29: Keep Flying!
A30: What’s Going on in the Engine Room? | B30: 1 | F30: Were there Space Monkeys? | G30: Tech 7 Breakdown; 1-6 Full Stop. 7+ Keep Flying. | H30: Just Rewire the Grav-Thrust | I30: --Spend 1 Part. --Keep Flying.
A31: What's That Noise? | C31: 1 | D31: 1 | F31: That Doesn't Sound Good… | G31: Tech 6 Breakdown; 1-5 Full Stop. 6+ Keep Flying. | H31: Gorram Parts Ain't Free | I31: --Spend 1 Part. --Keep Flying.
A32: Blown out Buffer Panel | E32: 1 | F32: Not to Fret | G32: Spend 1 Part. Keep Flying | H32: Shoulda Replaced that… | I32: Tech 6 Breakdown; 1-5 Full Stop. 6+ Keep Flying.
A33: Objects in Space | E33: 1 | F33: Fancy Meetin' You Here! | G33: -- If you have space in your Crew, take 1 Crew Card from any discard pile, for free. -- Full Stop | H33: Not Another Mouth to Feed | I33: Keep Flying.
A34: Ravaged Transport | E34: 1 | F34: Left Nothin' but Ghosts… | G34: Keep Flying! | H34: Surveyors of What's Left | I34: Requires Mechanic: Salvage Op: Load 2 Goods. Full Stop.
A35: Nav System on the Fritz | E35: 1 | F35: Those Stars Look Right to You? | G35: --The player to your right must move your ship two Sectors. Keep Flying. | H35: Recalibrate on the Fly. | I35: Requires Mechanic: Tech 7 Breakdown; 1-6 Full Stop. 7+ Keep Flying.
A36: Local Tariff Patrol | E36: 1 | F36: Heavy Handed Enforcement | G36: Negociate 9 Bribes; 1-8 5 Goods not in Stash are seized. Full Stop. 9+ Keep Flying | H36: Turn and Burn! | I36: Spend 1 Fuel. Warrant Issued. Evade
A37: Reaver Booby Trap | E37: 1 | F37: Hard to Port! | G37: Requires Pilot. Place Reaver Token in Sector. Spend 1 Fuel. Keep Flying. | H37: Reavers! Wong Dahn! | I37: Place Reaver Token in Sector. Full Stop.
A38: Reavers, Dead Ahead! | D38: 3 | E38: 3 | G38: --The player to your right must move a Reaver Ship to a Sector adjacent to your current location, not occupied by a Firefly. Keep Flying.
B39: =SUM(R[-37]C:R[-1]C) -> 40 | C39: =SUM(R[-37]C:R[-1]C) -> 40 | D39: =SUM(R[-37]C:R[-1]C) -> 40 | E39: =SUM(R[-37]C:R[-1]C) -> 33